,time_ago,titles,subtitles,location,images,Links
1575,31 May 2024,Will flying ever be sustainable?,Labour say they'll give businesses more flexibility on how they spend apprenticeships levy funding.,Culture,https://ichef.bbci.co.uk/news/480/cpsprodpb/90d4/live/4f4893f0-1e9d-11ef-80aa-699d54c46324.png.webp,https://www.bbc.com/reel/video/p0hymq3l/will-flying-ever-be-sustainable-
1576,2 Jun 2024,Data allegedly stolen from 560 million Ticketmaster users,"The band's 1990 Spike Island show went down in history, and a full recording has now come to light.",Norfolk,https://ichef.bbci.co.uk/news/480/cpsprodpb/e925/live/73838870-1f41-11ef-8aa6-ed4d7e5d0ef9.jpg.webp,https://www.bbc.com/news/articles/c899pz84d8zo
1577,2 Jun 2024,Barclays branches covered in red paint in pro-Palestine protest,The new East Grinstead and Uckfield constituency straddles the border between East and West Sussex.,South Yorkshire,https://ichef.bbci.co.uk/news/480/cpsprodpb/379f/live/ee855090-1f4a-11ef-8aa6-ed4d7e5d0ef9.jpg.webp,https://www.bbc.com/news/articles/czkkdpl0d35o
1578,2 Jun 2024,Windies survive PNG scare to win T20 World Cup opener,The videogame is the biggest title ever to be made available on a subscription service from day one.,BBC InDepth,https://ichef.bbci.co.uk/news/480/cpsprodpb/4ce5/live/957c3b10-21c7-11ef-baa7-25d483663b8e.jpg.webp,https://www.bbc.com/sport/cricket/articles/c1ww0x7d13zo
1579,5 Jun 2024,Labour plans apprenticeship funding shake-up,"Jane MacLeod, once the Post Office’s top in-house lawyer, refuses to give oral evidence at the Horizon IT inquiry.",Northamptonshire,https://ichef.bbci.co.uk/news/480/cpsprodpb/3443/live/ac758f90-20c0-11ef-85a7-c99a2121e7c5.jpg.webp,https://www.bbc.com/news/articles/c511058gzdpo
1580,29 May 2024,Recording of legendary Stone Roses gig revealed,The videogame is the biggest title ever to be made available on a subscription service from day one.,Business,https://ichef.bbci.co.uk/news/480/cpsprodpb/32e3/live/2ee08290-202c-11ef-8358-83c11746bfe1.jpg.webp,https://www.bbc.com/news/articles/c80065lx1n2o
1581,4 Jun 2024,Why is the Sussex political map changing?,"The Expedition Limitless team will kayak on a river in Canada for 12 days, sleeping on its banks.",Berkshire,https://ichef.bbci.co.uk/news/480/cpsprodpb/3b8b/live/22484940-21b3-11ef-b2d9-890ba52e2fc6.jpg.webp,https://www.bbc.com/news/articles/clll93zd849o
1582,29 May 2024,Call of Duty to go to Game Pass in gaming shake-up,US and EU crime agencies make arrests after suspects used information for fraud and bomb threats.,Oxford,https://ichef.bbci.co.uk/news/480/cpsprodpb/daca/live/73623b30-226a-11ef-a5d9-6b18e224880e.jpg.webp,https://www.bbc.com/news/articles/cneew1weereo
1583,1 Jun 2024,BBC challenges ex-Post Office lawyer in Australia,HMRC says it is sorry and that payments will now be made on Wednesday.,India,https://ichef.bbci.co.uk/news/480/cpsprodpb/2eb1/live/d6edd300-1dae-11ef-acc8-81cdbe1fe7bd.jpg.webp,https://www.bbc.com/news/articles/czdd33qd1j0o
1584,30 May 2024,Call of Duty to go to Game Pass in gaming shake-up,People are taking to the app to highlight the difficulty in achieving “traditional” milestones.,Culture,https://ichef.bbci.co.uk/images/ic/480x270/p0hz4ffy.jpg.webp,https://www.bbc.com/news/articles/cneew1weereo
1585,3 Jun 2024,Manx fundraisers set off on Canada kayak challenge,"In India's scorching summer heat, the ancient practice of chilling water in terracotta pots is inspiring new trends – from cooling towers to screens for buildings.",Jersey,https://ichef.bbci.co.uk/news/480/cpsprodpb/39d5/live/ddc6f9c0-1e4b-11ef-80aa-699d54c46324.jpg.webp,https://www.bbc.com/news/articles/cw44nv0y7z0o
1586,1 Jun 2024,Sports cars and millions seized in cybercrime busts,A former police officer fears she may not live to see the pension boost she has been promised.,Travel,https://ichef.bbci.co.uk/news/480/cpsprodpb/e661/live/94975820-1f3c-11ef-bc37-a510d5d4787d.jpg.webp,https://www.bbc.com/news/articles/c0448y8ryd3o
1587,1 Jun 2024,Half a million left without Child Benefit payment,The British Chambers of Commerce has called on the next government to help firms deal with the EU.,Essex,https://ichef.bbci.co.uk/news/480/cpsprodpb/2c86/live/a50227f0-2110-11ef-a13a-0b8c563da930.jpg.webp,https://www.bbc.com/news/articles/ceqqv249gn6o
1588,1 Jun 2024,TikTokers on why they have to delay ‘adulting’,A full-scale strike at the firm could have an impact on the global supply chains of electronics.,Business,https://ichef.bbci.co.uk/news/480/cpsprodpb/d3ce/live/f748ec20-203d-11ef-9b41-f58b08291af8.jpg.webp,https://www.bbc.com/news/videos/c9wwglpkpl1o
1589,30 May 2024,India's ancient terracotta air coolers,"Find out which constituency you are in, who you can vote for and where you can vote using our postcode search.",Oxford,https://ichef.bbci.co.uk/news/480/cpsprodpb/7b8c/live/23571e30-1f63-11ef-80aa-699d54c46324.jpg.webp,https://www.bbc.com/future/article/20240530-how-ancient-knowledge-of-terracotta-is-cooling-modern-indian-buildings
1590,29 May 2024,"'By the time my pension's sorted, will I be here?'",Councils agree to convert the loans into shares in the science park.,Manchester,https://ichef.bbci.co.uk/news/480/cpsprodpb/3c47/live/44b0e520-230f-11ef-96c3-99f9322e70a9.jpg.webp,https://www.bbc.com/news/articles/cjjjldez01xo
1591,3 Jul 2024,"Choppy times for firms must end, says lobby group",The King is the second monarch to appear on Bank of England notes which will be fed gradually into the system.,Business,https://ichef.bbci.co.uk/news/480/cpsprodpb/5496/live/49fdc940-1d9b-11ef-a090-6b563b2f66e3.jpg.webp,https://www.bbc.com/news/articles/c5114qxd1gro
1592,30 May 2024,Samsung Electronics union calls first-ever strike,The number of pupils moving to home education has risen by 22% in the past year.,Europe,https://ichef.bbci.co.uk/news/480/cpsprodpb/539f/live/2eb6c340-21c8-11ef-80aa-699d54c46324.jpg.webp,https://www.bbc.com/news/articles/cx7768n6pnpo
1593,5 Jun 2024,Who can I vote for in the general election?,The chief minister says a review will look at how AI could be used across government departments.,BBC InDepth,https://ichef.bbci.co.uk/news/480/cpsprodpb/5496/live/49fdc940-1d9b-11ef-a090-6b563b2f66e3.jpg.webp,https://www.bbc.com/news/articles/cw55nk6yn01o
1594,3 Jun 2024,Science park cannot repay millions in council loans,"The messaging app's boss has taken to social media to deny Mr Musk's claim it ""exports user data.""",Stoke & Staffordshire,https://ichef.bbci.co.uk/news/480/cpsprodpb/c4ec/live/6f6c1450-1f55-11ef-a13a-0b8c563da930.jpg.webp,https://www.bbc.com/news/articles/cxxx0yey638o
1595,30 May 2024,King Charles banknotes enter circulation,"James Cleverly says the prime minister will ""undoubtedly"" visit the region before the election.",Technology,https://ichef.bbci.co.uk/news/480/cpsprodpb/84d9/live/9c81efd0-1e21-11ef-95af-476bc99ab6d0.jpg.webp,https://www.bbc.com/news/articles/cxwwe9ndlkmo
1596,28 May 2024,Move to home education biggest since pandemic,Urgent and emergency care at the hospitals may not be able to access quick-turnaround blood test results.,London,https://ichef.bbci.co.uk/news/480/cpsprodpb/deda/live/3a975b50-21c0-11ef-a951-c529a701a554.jpg.webp,https://www.bbc.com/news/articles/cg3382380vko
1597,4 Jun 2024,AI could be used in public sector - chief minister,Synthetic aperture radar (SAR) allows satellites to bounce radar signals off the ground and interpret the echo – and it can even peer through clouds.,Africa,https://ichef.bbci.co.uk/news/480/cpsprodpb/6ce7/live/ae850130-1f58-11ef-a13a-0b8c563da930.jpg.webp,https://www.bbc.com/news/articles/cl771y4d1n8o
1598,4 Jun 2024,WhatsApp boss in online spat with Elon Musk,"The messaging app's boss has taken to social media to deny Mr Musk's claim it ""exports user data.""",Business,https://ichef.bbci.co.uk/images/ic/480x270/p0j19xkk.jpg.webp,https://www.bbc.com/news/articles/c0ddwymz8ero
1599,28 May 2024,"Tories 'committed' to South East, says Cleverly",Lancashire businessman Simon Sadler and his company Segantii are under investigation in Hong Kong.,Business,https://ichef.bbci.co.uk/news/480/cpsprodpb/bd5e/live/4c561ad0-19ae-11ef-af66-edd17488ddd3.jpg.webp,https://www.bbc.com/news/articles/cqll7l24d74o
1600,28 May 2024,Critical incident over London hospitals' cyber-attack,The Red Bull reserve driver has been speaking to BBC Newsbeat about gaming and getting into F1.,Wales,https://ichef.bbci.co.uk/news/480/cpsprodpb/3056/live/b74036e0-1e5f-11ef-a133-cf78601b4a93.png.webp,https://www.bbc.com/news/articles/c288n8rkpvno
1601,30 May 2024,The satellites that can peer almost everywhere,"One hundred years after the US designated the world's first wilderness area, an epic hike offers adventure seekers the chance to experience a slice of the nation's wild side.",England,https://ichef.bbci.co.uk/news/480/cpsprodpb/5a90/live/3f92f300-1d7c-11ef-b56a-e99eb4310325.jpg.webp,https://www.bbc.com/future/article/20240524-the-satellites-using-radar-to-peer-at-earth-in-minute-detail
1602,1 Jun 2024,WhatsApp boss in online spat with Elon Musk,"Yusuf Sonko, 18, was shot dead in Liverpool seven years ago but nobody has ever been charged.","Beds, Herts & Bucks",https://ichef.bbci.co.uk/news/480/cpsprodpb/df52/live/f8916280-232e-11ef-baa7-25d483663b8e.png.webp,https://www.bbc.com/news/articles/c0ddwymz8ero
1603,3 Jun 2024,Blackpool FC owner’s company to hand back cash,The Billericay School will be closed to several year groups on Monday.,Tayside & Central Scotland,https://ichef.bbci.co.uk/news/480/cpsprodpb/e7dc/live/fec06770-1df5-11ef-a459-37d30508059e.jpg.webp,https://www.bbc.com/news/articles/cx9979qq57eo
1604,31 May 2024,'Milton Keynes roundabouts helped me with Formula 1',The country has come up with an ambitious plan to become the engine room of the new green economy.,Africa,https://ichef.bbci.co.uk/news/480/cpsprodpb/5b1e/live/7f72a9f0-226f-11ef-b2c0-21721eceffb0.jpg.webp,https://www.bbc.com/news/articles/cnllgzkgxdgo
1605,1 Jun 2024,The US West Coast's 'greatest footpath',"Rory Neale, from Warwickshire, is fined £500 for flying the gadget over a campsite near Ballagarey.",Scotland,https://ichef.bbci.co.uk/news/480/cpsprodpb/8dfd/live/dcc65510-1dbb-11ef-b16b-635cf4924dd3.jpg.webp,https://www.bbc.com/travel/article/20240603-the-pacific-crest-trail-the-us-west-coasts-greatest-footpath
1606,5 Jun 2024,Murdered boy's mum begs witnesses to come forward,"The fast fashion firm has been linked to unethical practices, including claims of forced labour.",Travel,https://ichef.bbci.co.uk/news/480/cpsprodpb/6b7c/live/4e9c7770-1e87-11ef-a4a3-e15f8057ebd7.jpg.webp,https://www.bbc.com/news/articles/cd11lz2gnvko
1607,1 Jun 2024,School facing 'critical incident' after cyber attack,"The Canadian government is pushing hard for cities to build more ""fourplex"" apartment blocks.",Europe,https://ichef.bbci.co.uk/news/480/cpsprodpb/9370/live/1e7d6b50-1ce1-11ef-a36a-771f5fdb8b8a.jpg.webp,https://www.bbc.com/news/articles/cl44877v7xxo
1608,3 Jun 2024,Australia wants to become a renewable energy superpower. Can it?,The original design for the 1953 Everest expedition boot is still held in Kettering.,England,https://ichef.bbci.co.uk/news/480/cpsprodpb/21e3/live/626a3910-2263-11ef-b516-6deaab608533.jpg.webp,https://www.bbc.com/news/articles/cp00vyl6l6mo
1609,3 Jun 2024,Visiting fan fined for flying drone near TT course,Unite members at Port Talbot and Llanwern will begin a work to rule and overtime ban on 18 June.,Business,https://ichef.bbci.co.uk/news/480/cpsprodpb/263e/live/263514c0-226c-11ef-a5d9-6b18e224880e.jpg.webp,https://www.bbc.com/news/articles/c5119p0rglvo
1610,2 Jun 2024,Shein to kick off plans for £50bn UK float,The Irish star accuses Latitude's sponsor of investing in arms companies that trade with Israel.,Gloucestershire,https://ichef.bbci.co.uk/images/ic/480x270/p0j03djw.jpg.webp,https://www.bbc.com/news/articles/c9770yz274go
1611,31 May 2024,Could a housing revolution transform Canadian cities?,The college's comments come after more than 800 people sign a petition against its arts centre plan.,Europe,https://ichef.bbci.co.uk/news/480/cpsprodpb/9370/live/1e7d6b50-1ce1-11ef-a36a-771f5fdb8b8a.jpg.webp,https://www.bbc.com/news/articles/cjjjvnq4665o
1612,30 May 2024,Everest expedition boot 'still works' 71 years on,The announcement comes as the Euros football tournament is due to kick off in Germany next month.,Asia,https://ichef.bbci.co.uk/news/480/cpsprodpb/83ee/live/0fae3b80-1e6d-11ef-bf22-93f0833be1f1.jpg.webp,https://www.bbc.com/news/articles/czrr4g08mego
1613,30 May 2024,Steel union to start industrial action at Tata,Ryan Salame is one of four former top bosses from Sam Bankman-Fried's firms to plead guilty to charges.,Business,https://ichef.bbci.co.uk/news/480/cpsprodpb/c348/live/04937de0-1f59-11ef-9347-7f244eca80a1.jpg.webp,https://www.bbc.com/news/articles/c3ggde9vx2po
1614,28 May 2024,CMAT pulls out of Latitude over its Barclays links,"'I thought why don’t we give it a try?' said student Swapnil Shrivastav, after inspiration struck.",Future,https://ichef.bbci.co.uk/images/ic/480x270/p0j1hd93.jpg.webp,https://www.bbc.com/news/articles/c800ge2y02ro
1615,29 May 2024,College responds to criticism of UNESCO site plans,Firms are placing their Christmas orders early to avoid empty shelves as shipping route disruption continues.,Business,https://ichef.bbci.co.uk/news/480/cpsprodpb/c2b3/live/a536c7e0-1f20-11ef-9787-7f10e3b1cdce.jpg.webp,https://www.bbc.com/news/articles/cxxx082163zo
1616,28 May 2024,Beckham scores Euros deal with China tech giant,"'I thought why don’t we give it a try?' said student Swapnil Shrivastav, after inspiration struck.",Northamptonshire,https://ichef.bbci.co.uk/news/480/cpsprodpb/a5d2/live/0a433440-2000-11ef-80aa-699d54c46324.jpg.webp,https://www.bbc.com/news/articles/cn0091d3l0xo
1617,2 Jun 2024,Top lieutenant to 'Crypto King' jailed for seven years,Halifax's Dean Clough is the new site for the largest collection of old projectors in the country.,Northamptonshire,https://ichef.bbci.co.uk/news/480/cpsprodpb/0070/live/e6fb9140-1d6a-11ef-bf53-7391f3861154.jpg.webp,https://www.bbc.com/news/articles/cqee727vnzmo
1618,28 May 2024,Tackling water shortages with 'Star Wars' tech,"The Department for Education says AI has the potential to ""transform education"".",World,https://ichef.bbci.co.uk/news/480/cpsprodpb/6225/live/9ae6e740-1fff-11ef-974e-3bcab2fa589b.jpg.webp,https://www.bbc.com/news/articles/cd11nnwp646o
1619,28 May 2024,Shops rush for Christmas stock as shipping costs surge,Crystal Owen met a minister over her campaign for restrictions on young drivers.,Norfolk,https://ichef.bbci.co.uk/news/480/cpsprodpb/b65b/live/da085c50-2186-11ef-9628-ff2abcc9602e.png.webp,https://www.bbc.com/news/articles/cqee78djzmro
1620,27 May 2024,Tackling water shortages with 'Star Wars' tech,The regulator will examine the tie-up which is the biggest banking deal since the financial crisis.,Politics,https://ichef.bbci.co.uk/news/480/cpsprodpb/6179/live/27ef4190-21a0-11ef-baa7-25d483663b8e.jpg.webp,https://www.bbc.com/news/articles/cd11nnwp646o
1621,30 May 2024,Vintage cinema collection's new home at landmark mill,Bosses say it is expected the technology will save up to 500 tonnes of carbon dioxide.,Culture,https://ichef.bbci.co.uk/news/480/cpsprodpb/2440/live/88ecaf10-1f42-11ef-80aa-699d54c46324.jpg.webp,https://www.bbc.com/news/articles/crggjrm78y3o
1622,31 May 2024,Is AI the future of education in the South East?,"Your Voice, Your Vote puts your stories and issues at the heart of this year's general election.",Business,https://ichef.bbci.co.uk/news/480/cpsprodpb/c056/live/ae7e0e80-1eb7-11ef-9a3a-91e88c5a17f6.jpg.webp,https://www.bbc.com/news/articles/c999k57ky7ro
1623,27 May 2024,Crash victim's mum questions roads safety progress,Instagram is the latest battleground for caste identities - and the players are young Indian women.,Isle of Man,https://ichef.bbci.co.uk/news/480/cpsprodpb/4695/live/5e2307e0-1e91-11ef-82d2-170b0b292a3d.jpg.webp,https://www.bbc.com/news/articles/ce99qgn39qyo
1624,31 May 2024,Nationwide-Virgin merger faces competition probe,"Joan Clarke, who grew up London, was played by Keira Knightley in the 2014 film The Imitation Game.",Guernsey,https://ichef.bbci.co.uk/news/480/cpsprodpb/ec20/live/d6314310-1e59-11ef-986e-85bf00bd2d82.jpg.webp,https://www.bbc.com/news/articles/czddy1j0nnko
1625,31 May 2024,Geothermal energy used to heat Eden Project,"The gallery at Maidstone Museum will look at how people have lived ""over a vast span of time"".",Future,https://ichef.bbci.co.uk/news/480/cpsprodpb/5a1b/live/bd6be0c0-1ca5-11ef-81db-676ee6a0b817.jpg.webp,https://www.bbc.com/news/articles/c2llx99xdylo
1626,29 May 2024,"Your Voice, Your Vote: Tell us the election issues that matter to you",How AI tools are helping people with neurodiversity live their lives.,Isle of Man,https://ichef.bbci.co.uk/news/480/cpsprodpb/607a/live/77da45b0-1d4f-11ef-9052-d1ba94bfd298.jpg.webp,https://www.bbc.com/news/articles/cz440j1x4xno
1627,28 May 2024,The Indian women trumpeting their caste on Instagram,The festival said it could not safely go ahead in August after threats of disruption from climate activists.,Business,https://ichef.bbci.co.uk/news/480/cpsprodpb/e605/live/9e045140-16a6-11ef-a50f-8dde4e8806c8.png.webp,https://www.bbc.com/news/articles/cgrrq9e2pelo
1628,30 May 2024,WW2 code-breaker gets blue plaque at London home,"Magin Luis Caballero claimed he was ""thrown across the galley"" when RV Petrel toppled over in a Leith dry dock.",Surrey,https://ichef.bbci.co.uk/news/480/cpsprodpb/6f58/live/a82418a0-1f74-11ef-80aa-699d54c46324.jpg.webp,https://www.bbc.com/news/articles/cn00x2nprego
1629,31 May 2024,"Gallery to display artefacts from 600,000 years ago",The company will emerge from bankruptcy smaller and with less debt.,Future,https://ichef.bbci.co.uk/news/480/cpsprodpb/e605/live/9e045140-16a6-11ef-a50f-8dde4e8806c8.png.webp,https://www.bbc.com/news/articles/crggwjy2zgko
1630,28 May 2024,'The chatbot has transformed my life',Women share their stories of how they feel renting has held them back in life.,Wales,https://ichef.bbci.co.uk/news/480/cpsprodpb/bb67/live/7a401f90-1cf6-11ef-8fd8-8194490efeeb.jpg.webp,https://www.bbc.com/news/articles/c7223v5d8lgo
1631,31 May 2024,Edinburgh book festival ends Baillie Gifford sponsorship,Hundreds of people donned eye-catching outfits for the four-day event in Newark.,Business,https://ichef.bbci.co.uk/news/480/cpsprodpb/8c1e/live/b3b47620-1b40-11ef-991f-b1e960a71db8.jpg.webp,https://www.bbc.com/news/articles/cm553zrr3e4o
1632,28 May 2024,Cook injured in ship toppling sues US government for $10m,An investigation into the death of Amarpreet Bhatti at the Oxford North site is ongoing.,Golf,https://ichef.bbci.co.uk/news/480/cpsprodpb/5180/live/b4b21490-1df4-11ef-80aa-699d54c46324.jpg.webp,https://www.bbc.com/news/articles/cxeexz4r2d4o
1633,27 May 2024,WeWork set to emerge from bankruptcy,The 52-year-old captain admitted to passing information on munitions systems and aircraft to Moscow.,Business,https://ichef.bbci.co.uk/news/480/cpsprodpb/6a19/live/9fe3fd50-1f23-11ef-baa7-25d483663b8e.jpg.webp,https://www.bbc.com/news/articles/cljj3nxze6lo
1634,29 May 2024,'I put off starting a family because of a £300 rent rise',"Openreach says locations including Elstead, Tadworth and Ottershaw will benefit from the upgrade.",Hampshire & Isle of Wight,https://ichef.bbci.co.uk/news/480/cpsprodpb/29f7/live/3c7935c0-19e0-11ef-96c0-29950cf02be4.jpg.webp,https://www.bbc.com/news/business-69049450
1635,27 May 2024,Town's steampunk festival attracts largest crowd yet,We thought we broadly understood how planets and stars form. But the discovery of dozens of pairs of young planets in a nearby nebula threatens to turn that on its head.,Business,https://ichef.bbci.co.uk/news/480/cpsprodpb/10ab/live/7f9e6760-1f5a-11ef-80aa-699d54c46324.jpg.webp,https://www.bbc.com/news/articles/cv22regddk7o
1636,28 May 2024,Site where worker fell to death reaches milestone,"The artworks are a tribute to Stan Shaw, who crafted pocket knives for royalty and rock legends.",England,https://ichef.bbci.co.uk/news/480/cpsprodpb/21ac/live/9d609d50-1ea0-11ef-baa7-25d483663b8e.jpg.webp,https://www.bbc.com/news/articles/c4nnp1d39yeo
1637,31 May 2024,German army officer jailed for spying for Russia,"Federation of Sport has been given a £400,000 grant to bring a prominent space back into use.",Business,https://ichef.bbci.co.uk/news/480/cpsprodpb/4c51/live/68f4d0a0-1ddc-11ef-80aa-699d54c46324.png.webp,https://www.bbc.com/news/articles/cyeedd6kzdko
1638,27 May 2024,Surrey to benefit from broadband upgrade,"However, scientists say air pollution remains lower than before the Covid pandemic.",Northern Ireland Politics,https://ichef.bbci.co.uk/news/480/cpsprodpb/fc89/live/c48f2720-1a95-11ef-81f4-f551386666fd.jpg.webp,https://www.bbc.com/news/articles/cp66ldjygk1o
1639,30 May 2024,Orion's mysterious free-floating planets,"The investment, likely to be about £100m, aims to replace Red Funnel's ageing fleet.",Sussex,https://ichef.bbci.co.uk/news/480/cpsprodpb/d05b/live/f330ecb0-1907-11ef-876b-c77a1c45f857.jpg.webp,https://www.bbc.com/future/article/20240522-the-mystery-of-orions-free-floating-giant-twin-planets
1640,27 May 2024,Lasting tribute to cutler who made knife for Queen,"Martin Geissler, Kirsty Wark and Laura Miller will lead the corporation's election night coverage.",Wolverhampton,https://ichef.bbci.co.uk/news/480/cpsprodpb/72f3/live/31400ed0-1eaa-11ef-822b-27ee4a290614.jpg.webp,https://www.bbc.com/news/articles/cw44xvx7ve8o
1641,29 May 2024,New sports and gaming venue wins council backing,Jesse Norman has been the MP for Hereford & South Herefordshire since 2010.,Oxford,https://ichef.bbci.co.uk/news/480/cpsprodpb/ceb6/live/fdd70d00-1cf1-11ef-994c-b33a5bd925dd.jpg.webp,https://www.bbc.com/news/articles/cd11lv008v3o
1642,28 May 2024,Traffic in region returns to pre-Covid levels - data,The stone temple to the goddess Minerva is set to be rebuilt on land in the Goodwood Estate.,Nottingham,https://ichef.bbci.co.uk/news/480/cpsprodpb/b00f/live/97733d70-1ec4-11ef-b1fa-35fd56ce62a1.jpg.webp,https://www.bbc.com/news/articles/cqqq5v2lpleo
1643,28 May 2024,Solent ferry operator to order three new vessels,Live facial recognition is becoming increasingly common on UK high streets. Should we be worried?,Liverpool,https://ichef.bbci.co.uk/news/480/cpsprodpb/1440/production/_133348150_f1b59e67-3c36-444e-b8d7-b9fcbe930da0.jpg.webp,https://www.bbc.com/news/articles/cjqqvq8492wo
1644,30 May 2024,"Geissler, Wark and Miller to front BBC Scotland election coverage","Nationwide building society says prices rose by 0.4% despite buyers facing ""affordability pressures"".",Highlands & Islands,https://ichef.bbci.co.uk/news/480/cpsprodpb/d548/live/7d271860-1b81-11ef-b28f-7152a74ace54.jpg.webp,https://www.bbc.com/news/articles/ckdd18994wdo
1645,26 May 2024,Teacher named as Labour candidate,Both parties say a freeze on tax thresholds will remain for three years if they win the election.,UK Politics,https://ichef.bbci.co.uk/news/480/cpsprodpb/34ef/live/837e7f60-1cf7-11ef-8fd8-8194490efeeb.png.webp,https://www.bbc.com/news/articles/c1ddn1elnndo
1646,31 May 2024,Temple to Roman goddess rebuild approved,AI linked to everyday items could alert family members if elderly relatives have diverted from their normal morning routine.,Green living,https://ichef.bbci.co.uk/news/480/cpsprodpb/fa15/live/aa013590-1c1d-11ef-80aa-699d54c46324.jpg.webp,https://www.bbc.com/news/uk-england-sussex-69077223
1647,30 May 2024,'I was misidentified as shoplifter by facial recognition tech',"Slow income growth should be tackled with policies to improve productivity, a report suggests.",London,https://ichef.bbci.co.uk/news/480/cpsprodpb/8d53/live/99477610-1cf4-11ef-8fd8-8194490efeeb.jpg.webp,https://www.bbc.com/news/technology-69055945
1648,29 May 2024,UK house prices in surprise rise in May,The historically Eurocentric sport has found a new and growing fanbase in Africa.,Business,https://ichef.bbci.co.uk/images/ic/480x270/p0hznqdk.jpg.webp,https://www.bbc.com/news/articles/cw55v1e1ppzo
1649,31 May 2024,Labour and Tories confirm income tax squeeze,The items being auctioned belonged to a city eSports business which closed after less than a year.,England,https://ichef.bbci.co.uk/news/480/cpsprodpb/3a91/live/3aabfc60-19cb-11ef-a13a-0b8c563da930.jpg.webp,https://www.bbc.com/news/articles/crggz000lz7o
1650,30 May 2024,How a kettle could help keep older people safe,"Jian Wen, 42, was involved in converting Bitcoin into assets including multi-million-pound houses.",Business,https://ichef.bbci.co.uk/news/480/cpsprodpb/9f97/live/5ebb6ec0-1e7a-11ef-8d9e-91a964033e92.jpg.webp,https://www.bbc.com/news/videos/cp33xjj5x55o
1651,28 May 2024,Calls for action to boost living standards,"The device attaches to an inhaler and monitors how often it is used, before feeding data to an app.",Business,https://ichef.bbci.co.uk/news/480/cpsprodpb/c39b/live/6b8dba30-19da-11ef-80aa-699d54c46324.jpg.webp,https://www.bbc.com/news/articles/c7226wle322o
1652,29 May 2024,Africa's new F1 fans who want a race on the continent,The BBC investigates Ruja Ignatova’s close ties to a suspected organised crime boss.,Liverpool,https://ichef.bbci.co.uk/news/480/cpsprodpb/9d9d/live/572eb570-1d9b-11ef-a090-6b563b2f66e3.jpg.webp,https://www.bbc.com/news/articles/c3gg8542n14o
1653,28 May 2024,Arcade machines up for auction after business folds,Openreach says 67 towns and villages across six counties will benefit from a major broadband update.,Technology,https://ichef.bbci.co.uk/news/480/cpsprodpb/e02b/live/07c3d970-1cec-11ef-baa7-25d483663b8e.png.webp,https://www.bbc.com/news/articles/cmmmjz86v57o
1654,2 Jun 2024,Woman found with £2bn in Bitcoin jailed,The new pathology hub in Bournemouth aims to diagnose conditions in about 80% of patients.,Newsbeat,https://ichef.bbci.co.uk/news/480/cpsprodpb/09a6/live/5ab14fc0-1cdb-11ef-a3d7-35e6469fea02.jpg.webp,https://www.bbc.com/news/articles/cn001yr88zgo
