,time_ago,titles,subtitles,location,images,Links
473,2 Aug 2024,Man to walk 120 miles to attend cancer check-up,The boss of the nationalised Ferguson shipyard says more work is needed on the dual-fuel ferry.,Cambridgeshire,https://ichef.bbci.co.uk/news/480/cpsprodpb/a75b/live/10ef6d50-4ead-11ef-89d7-8f079f0ef96e.jpg.webp,https://www.bbc.com/news/articles/c3g9me4m7xmo
474,25 Jul 2024,New delivery delay for CalMac ferry Glen Sannox,"In a world where a single point of failure can throw our machines into chaos, everything from sharks to authoritarian governments to old ladies have brought the web to its knees.",Business,https://ichef.bbci.co.uk/news/480/cpsprodpb/be7e/live/f5b9a4c0-50bd-11ef-b2d2-cdb23d5d7c5b.jpg.webp,https://www.bbc.com/news/articles/c51y1x7lkdwo
475,24 Jul 2024,The day the internet turned off,"Papers please: for millions of Americans, accessing online pornography now requires a government ID. It could have global implications for the future of the web.",Business,https://ichef.bbci.co.uk/images/ic/480x270/p0jdbybk.jpg.webp,https://www.bbc.com/future/article/20240724-the-day-the-internet-turned-off
476,25 Jul 2024,How America's porn wars could change your internet,"In a world where a single point of failure can throw our machines into chaos, everything from sharks to authoritarian governments to old ladies have brought the web to its knees.",Future,https://ichef.bbci.co.uk/images/ic/480x270/p0jd51tt.jpg.webp,https://www.bbc.com/future/article/20240723-how-the-american-war-on-porn-could-change-your-internet
477,25 Jul 2024,The day the internet turned off,"Cybersecurity firm is branded a ""clown show"" for gesture after an update caused widespread disruption.",Culture,https://ichef.bbci.co.uk/images/ic/480x270/p0jdbybk.jpg.webp,https://www.bbc.com/future/article/20240724-the-day-the-internet-turned-off
478,7 Aug 2024,CrowdStrike backlash over $10 apology voucher,"Disney swings to a pre-tax profit, largely thanks to the highest-grossing animated film ever.",Asia,https://ichef.bbci.co.uk/news/480/cpsprodpb/82e8/live/b8e79af0-4a75-11ef-9ce5-f32874646ca6.jpg.webp,https://www.bbc.com/news/articles/ce58p0048r0o
479,24 Jul 2024,Inside Out 2 boosts Disney as theme parks struggle,"Papers please: for millions of Americans, accessing online pornography now requires a government ID. It could have global implications for the future of the web.",Kent,https://ichef.bbci.co.uk/news/480/cpsprodpb/c425/live/bdb67c20-54bd-11ef-a3c5-a912b356e1cf.jpg.webp,https://www.bbc.com/news/articles/c049p51qkd0o
480,24 Aug 2024,How America's porn wars could change your internet,"Rising energy prices and the withdrawal of financial support will hit some hard, charities say.",Sussex,https://ichef.bbci.co.uk/images/ic/480x270/p0jd51tt.jpg.webp,https://www.bbc.com/future/article/20240723-how-the-american-war-on-porn-could-change-your-internet
481,4 Aug 2024,Charities fear double energy price hit for pensioners,A consultation on where to invest £17m in new charging points in West Yorkshire is under way.,Newsbeat,https://ichef.bbci.co.uk/news/480/cpsprodpb/cb83/live/fd22c570-617f-11ef-8c59-8955ba72b898.jpg.webp,https://www.bbc.com/news/articles/cy5409qq5xyo
482,2 days ago,Views sought on electric vehicle infrastructure,Ticket inspectors are urged to treat fare dodgers differently from people who make genuine mistakes.,Business,https://ichef.bbci.co.uk/news/480/cpsprodpb/2ed5/live/83238cb0-50c1-11ef-9dad-073bd3956ad4.jpg.webp,https://www.bbc.com/news/articles/c7292eyr33yo
483,7 Aug 2024,'We were fined £50 each over £3 extra train fare',The service will see drones delivering goods to and from Mornington Road car park on the Isle of Wight.,Future,https://ichef.bbci.co.uk/news/480/cpsprodpb/696c/live/11011f00-66b3-11ef-b43e-6916dcba5cbf.jpg.webp,https://www.bbc.com/news/articles/c0l841xeyklo
484,23 Jul 2024,Drone trial paused following residents' concerns,"The proposed deal will affect students in Loughborough, Coalville and Melton.",Nottingham,https://ichef.bbci.co.uk/news/480/cpsprodpb/ac69/live/ffeaa700-54a5-11ef-b2d2-cdb23d5d7c5b.jpg.webp,https://www.bbc.com/news/articles/cwy39gnq4y3o
485,23 Aug 2024,Colleges aim to 'combine strengths' through merger,Drought and conflict with farmers are threatening Bolivia's Andean bear – the real-life Paddington Bear. Now a beekeeping project is helping protect this endangered species.,Surrey,https://ichef.bbci.co.uk/news/480/cpsprodpb/b6e8/live/5c0577b0-4815-11ef-b472-7bbc8ac9f334.jpg.webp,https://www.bbc.com/news/articles/cx72jd7w1eeo
486,7 Aug 2024,Learning to live with a hungry 'Paddington Bear',"Disney swings to a pre-tax profit, largely thanks to the highest-grossing animated film ever.","Beds, Herts & Bucks",https://ichef.bbci.co.uk/images/ic/480x270/p0jkbzzt.jpg.webp,https://www.bbc.com/future/article/20240819-how-beekeeping-is-protecting-the-real-life-paddington-bear-in-bolivias-andes
487,24 Jul 2024,Inside Out 2 boosts Disney as theme parks struggle,The billionaire has been pushing Tesla to cut costs as car sales weaken.,Asia,https://ichef.bbci.co.uk/news/480/cpsprodpb/c425/live/bdb67c20-54bd-11ef-a3c5-a912b356e1cf.jpg.webp,https://www.bbc.com/news/articles/c049p51qkd0o
488,2 days ago,Musk says Tesla to use humanoid robots next year,Ticket inspectors are urged to treat fare dodgers differently from people who make genuine mistakes.,Business,https://ichef.bbci.co.uk/news/480/cpsprodpb/016b/live/c5912f70-4898-11ef-9df7-1ba747fb1c2b.jpg.webp,https://www.bbc.com/news/articles/cz5reve8476o
489,4 Aug 2024,'We were fined £50 each over £3 extra train fare',A consultation on where to invest £17m in new charging points in West Yorkshire is under way.,Kent,https://ichef.bbci.co.uk/news/480/cpsprodpb/696c/live/11011f00-66b3-11ef-b43e-6916dcba5cbf.jpg.webp,https://www.bbc.com/news/articles/c0l841xeyklo
490,25 Jul 2024,Views sought on electric vehicle infrastructure,"Cybersecurity firm is branded a ""clown show"" for gesture after an update caused widespread disruption.",Newsbeat,https://ichef.bbci.co.uk/news/480/cpsprodpb/2ed5/live/83238cb0-50c1-11ef-9dad-073bd3956ad4.jpg.webp,https://www.bbc.com/news/articles/c7292eyr33yo
491,15 Aug 2024,CrowdStrike backlash over $10 apology voucher,Strong growth in the services sector helped the UK to continue to emerge from last year's recession.,North Yorkshire,https://ichef.bbci.co.uk/news/480/cpsprodpb/82e8/live/b8e79af0-4a75-11ef-9ce5-f32874646ca6.jpg.webp,https://www.bbc.com/news/articles/ce58p0048r0o
492,29 Jul 2024,UK economy continues recovery with 0.6% growth,"Norway's oil wealth has made it one of the world's richest countries, but some feel bad about it.",Future,https://ichef.bbci.co.uk/news/480/cpsprodpb/6b6b/live/ae358920-5ad6-11ef-b95c-592c91b0fe82.jpg.webp,https://www.bbc.com/news/articles/cq82y55jg35o
493,31 Jul 2024,'Not every Norwegian feels guilty but many do',Over 158 people have been killed in the massive landslides that struck southern India on Tuesday.,Business,https://ichef.bbci.co.uk/news/480/cpsprodpb/3fa1/live/39f3c770-49c4-11ef-8717-1911c42aa067.jpg.webp,https://www.bbc.com/news/articles/cz5r2mk18k1o
494,24 Jul 2024,The scenic Indian villages devastated by deadly landslides,The billionaire has been pushing Tesla to cut costs as car sales weaken.,Business,https://ichef.bbci.co.uk/news/480/cpsprodpb/4da6/live/c72409b0-4f15-11ef-b1f9-6193958006be.jpg.webp,https://www.bbc.com/news/articles/ckkge0pnxy3o
495,22 Aug 2024,Musk says Tesla to use humanoid robots next year,These students were in Year 7 during the first Covid lockdowns - and regional disparities have grown.,Future,https://ichef.bbci.co.uk/news/480/cpsprodpb/016b/live/c5912f70-4898-11ef-9df7-1ba747fb1c2b.jpg.webp,https://www.bbc.com/news/articles/cz5reve8476o
496,31 Jul 2024,Four takeaways from 2024's GCSE results,Over 158 people have been killed in the massive landslides that struck southern India on Tuesday.,Lancashire,https://ichef.bbci.co.uk/news/480/cpsprodpb/3efd/live/42203240-6093-11ef-ac2e-0dde5f4fd683.jpg.webp,https://www.bbc.com/news/articles/c33nvg1zj11o
497,29 Jul 2024,The scenic Indian villages devastated by deadly landslides,"Norway's oil wealth has made it one of the world's richest countries, but some feel bad about it.",Newsbeat,https://ichef.bbci.co.uk/news/480/cpsprodpb/4da6/live/c72409b0-4f15-11ef-b1f9-6193958006be.jpg.webp,https://www.bbc.com/news/articles/ckkge0pnxy3o
498,7 Aug 2024,'Not every Norwegian feels guilty but many do',"When a hurricane knocks out the power grid, a handful of ""community lighthouses"" could offer a crucial lifeline.",Birmingham & Black Country,https://ichef.bbci.co.uk/news/480/cpsprodpb/3fa1/live/39f3c770-49c4-11ef-8717-1911c42aa067.jpg.webp,https://www.bbc.com/news/articles/cz5r2mk18k1o
499,17 Aug 2024,New Orleans is building a new kind of lighthouse,Vice-president Kamala Harris targets housing costs and price gouging in newly-released economic plans.,Business,https://ichef.bbci.co.uk/images/ic/480x270/p0jgvzsb.jpg.webp,https://www.bbc.com/future/article/20240806-the-lighthouses-protecting-new-orleans-from-hurricane-blackouts
500,16 Aug 2024,New homes and end to price-gouging: Harris sets economic goals,"Aslef said the action, separate to the recent pay dispute, was due to a breakdown in industrial relations.",Business,https://ichef.bbci.co.uk/news/480/cpsprodpb/8106/live/06c732c0-5bde-11ef-824d-3d48c279d1e3.jpg.webp,https://www.bbc.com/news/articles/cy8xqy0jv24o
501,7 Aug 2024,LNER train drivers to stage fresh weekend strikes,"McLaren boss Zak Brown says he is ""surprised"" by his team's F1 title challenge this season.",Birmingham & Black Country,https://ichef.bbci.co.uk/news/480/cpsprodpb/8d4f/live/9c56a990-5bb8-11ef-8dd1-e1ed167acd82.jpg.webp,https://www.bbc.com/news/articles/cj9le7vdw91o
502,8 Aug 2024,"McLaren boss Brown on title fight, revival and Newey","Powers to stop social media being used to incite violence must be sped up, a Sheffield MP says.",Business,https://ichef.bbci.co.uk/news/480/cpsprodpb/ed39/live/9c4b4b50-531a-11ef-a3e9-cf709eefac05.jpg.webp,https://www.bbc.com/sport/articles/clynnlndevjo
503,7 Aug 2024,Urgency call over social media powers,"When a hurricane knocks out the power grid, a handful of ""community lighthouses"" could offer a crucial lifeline.",Wales,https://ichef.bbci.co.uk/news/480/cpsprodpb/7223/live/9a140060-54c4-11ef-b2d2-cdb23d5d7c5b.jpg.webp,https://www.bbc.com/news/articles/c785d7j1n17o
504,17 Aug 2024,New Orleans is building a new kind of lighthouse,Vice-president Kamala Harris targets housing costs and price gouging in newly-released economic plans.,Future,https://ichef.bbci.co.uk/images/ic/480x270/p0jgvzsb.jpg.webp,https://www.bbc.com/future/article/20240806-the-lighthouses-protecting-new-orleans-from-hurricane-blackouts
505,15 Aug 2024,New homes and end to price-gouging: Harris sets economic goals,"The proposed offer has ""no-strings"" and sees a backdated pay rise and increases in future for drivers.",Scotland Politics,https://ichef.bbci.co.uk/news/480/cpsprodpb/8106/live/06c732c0-5bde-11ef-824d-3d48c279d1e3.jpg.webp,https://www.bbc.com/news/articles/cy8xqy0jv24o
506,5 Aug 2024,Train strikes near end as union and government agree deal,"Long before a hurricane makes landfall, it has already caused havoc at sea, forcing ships to reroute and burn more fuel.",West Yorkshire,https://ichef.bbci.co.uk/news/480/cpsprodpb/b5a1/live/21c81400-599e-11ef-8d93-8d643c9e2380.jpg.webp,https://www.bbc.com/news/articles/cp9rxdrj713o
507,7 Aug 2024,What happens when ships dodge hurricanes,Lucy Connolly says she regrets calling for hotels housing migrants to be set on fire.,Future,https://ichef.bbci.co.uk/images/ic/480x270/p0jgm6hb.jpg.webp,https://www.bbc.com/future/article/20240805-hurricane-debby-why-hurricanes-increase-shipping-emissions
508,20 Jul 2024,Wife of Tory councillor bailed over race-hate post,The Discovery Museum exhibit explores energy technology from Victorian coal mining to green energy.,The Papers,https://ichef.bbci.co.uk/news/480/cpsprodpb/ed8c/live/d956d8b0-54a1-11ef-b2d2-cdb23d5d7c5b.jpg.webp,https://www.bbc.com/news/articles/cr40x2z7vn0o
509,2 days ago,Exhibit explores history and future of energy tech,Employees could get greater powers to work their contracted hours over fewer days.,Latin America,https://ichef.bbci.co.uk/news/480/cpsprodpb/ac58/live/4d9f9290-42b2-11ef-bcf7-c1ba84ff5cdc.jpg.webp,https://www.bbc.com/news/articles/c4ngv11k1elo
510,11 Aug 2024,Workers' rights to four-day week could be strengthened,"Plans for East Havering Data Centre, proposed to be built on greenbelt land, have sparked controversy.",UK,https://ichef.bbci.co.uk/news/480/cpsprodpb/21d4/live/3f7ec760-66bd-11ef-b970-9f202720b57a.jpg.webp,https://www.bbc.com/news/articles/c4gl5w83z7do
511,13 Aug 2024,Council leader declares support for data centre plan,"The UK's unemployment rate fell to 4.2% in the three months to the end of June, figures suggest.",Business,https://ichef.bbci.co.uk/news/480/cpsprodpb/15ae/live/d173e5e0-562f-11ef-9449-39bd2311eee9.jpg.webp,https://www.bbc.com/news/articles/c5y857yx21go
512,22 Jul 2024,UK unemployment falls slightly as pay growth slows,It is using UK Space Agency funding for a project on the International Space station.,Scotland Politics,https://ichef.bbci.co.uk/news/480/cpsprodpb/5549/live/39655760-589c-11ef-81ca-012e9993ac1f.jpg.webp,https://www.bbc.com/news/articles/c2l1000q4ywo
513,2 Aug 2024,Company wins funding to make medicine in space,Scientists say huge invisible ribbons of water vapour in the sky are partly to be blamed for floods in India.,Business,https://ichef.bbci.co.uk/news/480/cpsprodpb/ef32/live/f4485560-4694-11ef-a0cb-456564dc120c.jpg.webp,https://www.bbc.com/news/articles/cp9vdxwjddeo
514,7 Aug 2024,The ‘flying rivers’ causing devastating floods in India,Lucy Connolly says she regrets calling for hotels housing migrants to be set on fire.,Future,https://ichef.bbci.co.uk/news/480/cpsprodpb/d532/live/6470fd10-4feb-11ef-a2b2-651941bfb3ca.jpg.webp,https://www.bbc.com/news/articles/cv2g9x47441o
515,5 Aug 2024,Wife of Tory councillor bailed over race-hate post,The new footbridge provides passage over Twyford Marina's river entrance and better boat access.,London,https://ichef.bbci.co.uk/news/480/cpsprodpb/ed8c/live/d956d8b0-54a1-11ef-b2d2-cdb23d5d7c5b.jpg.webp,https://www.bbc.com/news/articles/cr40x2z7vn0o
516,20 Jul 2024,Fishing nets recycled to build low-carbon bridge,The Discovery Museum exhibit explores energy technology from Victorian coal mining to green energy.,West Yorkshire,https://ichef.bbci.co.uk/news/480/cpsprodpb/3bb9/live/080bab20-5021-11ef-894a-b30f1ca6afb0.jpg.webp,https://www.bbc.com/news/articles/c4ng118ppd2o
517,6 Aug 2024,Exhibit explores history and future of energy tech,"On 2 August 1939, Albert Einstein wrote a letter that would result in the Manhattan Project, and one of history's most significant, and destructive, inventions – the atomic bomb.",Gloucestershire,https://ichef.bbci.co.uk/news/480/cpsprodpb/ac58/live/4d9f9290-42b2-11ef-bcf7-c1ba84ff5cdc.jpg.webp,https://www.bbc.com/news/articles/c4ngv11k1elo
518,7 Aug 2024,The letter that changed the course of history,"The mortgage lender says lower borrowing costs could fuel a ""modest"" rise in house prices.",The Papers,https://ichef.bbci.co.uk/images/ic/480x270/p0jgp3gb.jpg.webp,https://www.bbc.com/culture/article/20240801-it-was-the-one-great-mistake-in-my-life-the-letter-from-einstein-that-ushered-in-the-age-of-the-atomic-bomb
519,14 Aug 2024,"Rate cuts to fuel house price rises, Halifax says","The UK inflation rate has risen to 2.2%, but this was not as high as economists had forecast.",Peterborough,https://ichef.bbci.co.uk/news/480/cpsprodpb/d761/live/8e7058a0-547c-11ef-aebc-6de4d31bf5cd.jpg.webp,https://www.bbc.com/news/articles/ce9zjgex85po
520,30 Jul 2024,Inflation rate rises for first time this year to 2.2%,Campaigners against a plan for a new sewage plant want the Labour government to block the project.,Wales,https://ichef.bbci.co.uk/news/480/cpsprodpb/2b9e/live/74c66b10-5a0d-11ef-9599-994cc2b5f394.jpg.webp,https://www.bbc.com/news/articles/ceq59pqr9qxo
521,4 days ago,Campaigners urge Labour to block sewage plant plan,The Citizens' Advice warning comes as energy firms meet the government for talks on help with bills.,Derby,https://ichef.bbci.co.uk/news/480/cpsprodpb/762c/live/2ea0d9f0-4e6d-11ef-aebc-6de4d31bf5cd.jpg.webp,https://www.bbc.com/news/articles/czd9zvjg9kgo
522,7 Aug 2024,Help with energy bills urged for struggling pensioners,"The mortgage lender says lower borrowing costs could fuel a ""modest"" rise in house prices.",Derby,https://ichef.bbci.co.uk/news/480/cpsprodpb/5d84/live/ce51e3c0-6535-11ef-b970-9f202720b57a.jpg.webp,https://www.bbc.com/news/articles/clyg3nk8kjno
523,16 Aug 2024,"Rate cuts to fuel house price rises, Halifax says",Florida is embarking on an ambitious ecological restoration project in the Everglades: building a reservoir large enough to secure the state's water supply.,Wales,https://ichef.bbci.co.uk/news/480/cpsprodpb/d761/live/8e7058a0-547c-11ef-aebc-6de4d31bf5cd.jpg.webp,https://www.bbc.com/news/articles/ce9zjgex85po
524,1 Aug 2024,The world's largest environmental restoration plan,Video game performers are concerned that generative AI could be used to reproduce their voices.,Derby,https://ichef.bbci.co.uk/images/ic/480x270/p0jjn444.jpg.webp,https://www.bbc.com/future/article/20240815-floridas-everglades-reservoir-will-clean-the-states-water
525,25 Jul 2024,Video games strike rumbles on in row over AI,A hacking group has been hunting information in areas from uranium enrichment to tanks and submarines.,Business,https://ichef.bbci.co.uk/news/480/cpsprodpb/a7e8/live/7ac5b3a0-4fd5-11ef-b8a6-c9027db4120d.jpg.webp,https://www.bbc.com/news/articles/czvxz11gl57o
526,25 Jul 2024,"North Korea hackers trying to steal nuclear secrets, US and UK warn",Kent council leaders want the government to help reduce potential delays caused by the system.,England,https://ichef.bbci.co.uk/news/480/cpsprodpb/cdbc/live/b7a19020-4aa6-11ef-9d7d-8f2c8d9c3d2a.jpg.webp,https://www.bbc.com/news/articles/cjl6p3wj52no
527,27 Jul 2024,Urgent action needed on border checks - Kent leaders,Kate Flett organised the JackoFest event in Bexhill to raise money for child-bereavement charities.,London,https://ichef.bbci.co.uk/news/480/cpsprodpb/9aed/live/79e58c50-49c0-11ef-acea-755e48e79f51.jpg.webp,https://www.bbc.com/news/articles/c978r3dy3gno
528,21 Aug 2024,Mother launches music festival in memory of son,"Setting the stage for the next 12 months, here is what we found out from Europe's biggest gaming show.",Technology,https://ichef.bbci.co.uk/news/480/cpsprodpb/a9aa/live/b38f4bd0-4c1d-11ef-a63e-258ce3a9f30d.jpg.webp,https://www.bbc.com/news/articles/c51yznwqxg4o
529,16 Aug 2024,Seven things we learned from Gamescom opening night,"Industry professionals say Game Informer will be ""much-missed"" after 33 years of gaming coverage.",US & Canada,https://ichef.bbci.co.uk/news/480/cpsprodpb/7bd2/live/c9a206a0-5fab-11ef-b56c-b1ea4410f82c.jpg.webp,https://www.bbc.com/news/articles/cy8xjqg2e9jo
530,11 Aug 2024,Respected gaming magazine praised after sudden closure,Florida is embarking on an ambitious ecological restoration project in the Everglades: building a reservoir large enough to secure the state's water supply.,Technology,https://ichef.bbci.co.uk/news/480/cpsprodpb/187a/live/5c473b10-5b2e-11ef-997c-711b7066309d.jpg.webp,https://www.bbc.com/news/articles/ce9z8k8g0g9o
531,16 Aug 2024,Insurers urged to make quick riot damage payouts,"The concern that Valdo Calocane could ""end up killing someone"" appears in a summary of medical records shared with BBC Panorama.",London,https://ichef.bbci.co.uk/news/480/cpsprodpb/9644/live/e8904bc0-57e6-11ef-b66c-517861374086.png.webp,https://www.bbc.com/news/articles/c79w1rrrg39o
532,12 Aug 2024,The world's largest environmental restoration plan,A recent case resulted in four members of an organised crime group being jailed for more than 12 years.,US & Canada,https://ichef.bbci.co.uk/images/ic/480x270/p0jjn444.jpg.webp,https://www.bbc.com/future/article/20240815-floridas-everglades-reservoir-will-clean-the-states-water
533,23 Aug 2024,Doctor warned Nottingham attacker could kill,Bedfordshire Police is using the technology for the first time in the county this weekend.,Business,https://ichef.bbci.co.uk/news/480/cpsprodpb/82ed/live/0a13f000-563c-11ef-aebc-6de4d31bf5cd.jpg.webp,https://www.bbc.com/news/articles/c990rmvy4ero
534,20 Jul 2024,'In 60 seconds the car was started and stolen',A hacking group has been hunting information in areas from uranium enrichment to tanks and submarines.,Business,https://ichef.bbci.co.uk/news/480/cpsprodpb/f205/live/51735150-5fc6-11ef-90f5-0de53a0b76ac.jpg.webp,https://www.bbc.com/news/articles/cd161wvp6dxo
535,25 Jul 2024,Concerns over facial recognition at river festival,"Surveyors expect property sales to pick up in the autumn, as a survey suggests buyers make swift decisions.",Future,https://ichef.bbci.co.uk/news/480/cpsprodpb/4482/live/98ddafa0-45e4-11ef-9e1c-3b4a473456a6.jpg.webp,https://www.bbc.com/news/articles/c06kegyrkvlo
536,8 Aug 2024,"North Korea hackers trying to steal nuclear secrets, US and UK warn",Kent council leaders want the government to help reduce potential delays caused by the system.,Business,https://ichef.bbci.co.uk/news/480/cpsprodpb/cdbc/live/b7a19020-4aa6-11ef-9d7d-8f2c8d9c3d2a.jpg.webp,https://www.bbc.com/news/articles/cjl6p3wj52no
537,25 Jul 2024,House hunting picks up as some offer after 20 minutes,"Setting the stage for the next 12 months, here is what we found out from Europe's biggest gaming show.",Technology,https://ichef.bbci.co.uk/news/480/cpsprodpb/b910/live/4ffc6ca0-54ed-11ef-8f0f-0577398c3339.jpg.webp,https://www.bbc.com/news/articles/credj9geenno
538,21 Aug 2024,Urgent action needed on border checks - Kent leaders,Danny Stenhouse says he hopes his success will inspire others.,Technology,https://ichef.bbci.co.uk/news/480/cpsprodpb/9aed/live/79e58c50-49c0-11ef-acea-755e48e79f51.jpg.webp,https://www.bbc.com/news/articles/c978r3dy3gno
539,11 Aug 2024,Seven things we learned from Gamescom opening night,"Scientists are turning to a controversial approach to test new vaccines and treatments by deliberately infecting volunteers with potentially deadly viruses, parasites and bacteria.",Asia,https://ichef.bbci.co.uk/news/480/cpsprodpb/7bd2/live/c9a206a0-5fab-11ef-b56c-b1ea4410f82c.jpg.webp,https://www.bbc.com/news/articles/cy8xjqg2e9jo
540,5 days ago,Man's viral sanding videos helped turn life around,The US Transportation Secretary said Delta must honour rules granting refunds to travellers.,Future,https://ichef.bbci.co.uk/news/480/cpsprodpb/71e1/live/8f502720-54c5-11ef-910e-bf510153e0a7.jpg.webp,https://www.bbc.com/news/articles/cp3dd5p2de0o
541,24 Jul 2024,The people purposely being infected with diseases,"Very few organisations will buy software from the US firm, partly thanks to its criticism of Beijing.",Business,https://ichef.bbci.co.uk/images/ic/480x270/p0jlt4g9.jpg.webp,https://www.bbc.com/future/article/20240823-why-some-people-are-volunteering-to-be-infected-with-diseases
542,20 Jul 2024,Delta faces probe as CrowdStrike disruption lingers,"Whilst Europe grapples with how to deal with growing wolf populations, this mountainous region of Portugal has coexisted with the predators for centuries.",Norfolk,https://ichef.bbci.co.uk/news/480/cpsprodpb/f23a/live/744fefa0-4903-11ef-8b75-d7877c28e64f.png.webp,https://www.bbc.com/news/articles/c3gdlm4079ro
543,9 Aug 2024,How China swerved worst of global tech meltdown,"Social media accounts are offering access to a fake live stream in exchange for likes, follows and money.",Hereford & Worcester,https://ichef.bbci.co.uk/news/480/cpsprodpb/d485/live/93db0500-46a4-11ef-bd62-35cc0bbc7c1d.jpg.webp,https://www.bbc.com/news/articles/c3g01y047pdo
544,7 Aug 2024,'My two favourite animals are sheep and wolves',The YouTuber's co-host Ava Kris Tyson denies claims online she groomed a teenager when she was 20.,Technology,https://ichef.bbci.co.uk/images/ic/480x270/p0jh5z3f.jpg.webp,https://www.bbc.com/future/article/20240808-in-portugal-shepherds-coexist-with-wolves
545,25 Jul 2024,"Scammers target Jay Slater's funeral, charity says",The prime minister says talk of two-tier policing is wrong and dangerous.,Wales,https://ichef.bbci.co.uk/news/480/cpsprodpb/ef96/live/8a87dbd0-5424-11ef-9750-ef79ad7ed343.jpg.webp,https://www.bbc.com/news/articles/cm2nnrg25deo
546,9 Aug 2024,MrBeast hires investigators over co-host grooming claims,Customers pointed out that the listing used a phrase deployed by racists to avoid language filters.,Business,https://ichef.bbci.co.uk/news/480/cpsprodpb/6ecf/live/c9c71330-4a54-11ef-81b1-e9d694834d0d.jpg.webp,https://www.bbc.com/news/articles/cgr5pgevr39o
547,26 Jul 2024,Musk's criticism of disorder response 'dangerous',The makers of athletics tracks are tweaking their surfaces to make them faster.,Business,https://ichef.bbci.co.uk/news/480/cpsprodpb/b365/live/8cfecbc0-5583-11ef-a885-7fc9068b8f06.png.webp,https://www.bbc.com/news/articles/cvg5lr7m0yxo
548,23 Jul 2024,Sainsbury's sorry for 'racist slur' trouser detail,"As many as 74,000 cases could be overturned after a ruling by the chief magistrate of England and Wales.",England,https://ichef.bbci.co.uk/news/480/cpsprodpb/a259/live/135fc470-4aa4-11ef-b075-9f5be32a5343.png.webp,https://www.bbc.com/news/articles/c9e9l84geddo
549,15 Aug 2024,What makes an athletics track fast?,The prime minister says talk of two-tier policing is wrong and dangerous.,Technology,https://ichef.bbci.co.uk/news/480/cpsprodpb/30a6/live/bad0ba50-48d5-11ef-b74c-bb483a802c97.jpg.webp,https://www.bbc.com/news/articles/crg4d5vn0n0o
