,time_ago,titles,subtitles,location,images,Links
1021,6 Jul 2024,Festival aims to spark interest in science,People have until 9 August to register interest in the project to install renewable energy tech.,Business,https://ichef.bbci.co.uk/news/480/cpsprodpb/6a44/live/642a1d40-3877-11ef-8a0a-5d92815c72ec.jpg.webp,https://www.bbc.com/news/articles/c8886xj1ngdo
1022,29 Jun 2024,Starmer names first cabinet after landslide win,"Lucius Banda, who has died aged 53, became known as the ""soldier"" for the voiceless.",Business,https://ichef.bbci.co.uk/news/480/cpsprodpb/c402/live/f6519d40-37ca-11ef-bbe0-29f79e992ddd.jpg.webp,https://www.bbc.com/news/articles/cw0yg50zy5vo
1023,1 Jul 2024,Who's in Keir Starmer's new cabinet?,"The decorated US downhill skier opens up to Katty Kay about the mental state that led her to gold medal victory and the ""hole"" that's left when her mind isn't on winning anymore.",Business,https://ichef.bbci.co.uk/news/480/cpsprodpb/f872/live/238184c0-3d0b-11ef-bdc5-41d7421c2adf.jpg.webp,https://www.bbc.com/news/articles/c0veg88g7jyo
1024,1 Jul 2024,Solar panel scheme gets further roll-out,The charging time is much quicker than even the fastest-charging batteries currently on the market.,Business,https://ichef.bbci.co.uk/news/480/cpsprodpb/ebbf/live/c14c1810-39b8-11ef-8058-192296adb2dc.jpg.webp,https://www.bbc.com/news/articles/cy94yklwxpqo
1025,28 Jun 2024,The Malawi music icon who became a 'soldier for the poor',How endangered species are smuggled out of Africa and what is being done to prevent it.,Coventry & Warwickshire,https://ichef.bbci.co.uk/news/480/cpsprodpb/165d/live/abda5cd0-344f-11ef-a044-9d4367d5b599.jpg.webp,https://www.bbc.com/news/articles/c6p2ldnyxv3o
1026,4 Jul 2024,Influential with Katty Kay: Lindsey Vonn,A month-long excavation finds further fragments from a bucket that was first discovered in 1986.,Health,https://ichef.bbci.co.uk/news/480/cpsprodpb/d7a7/live/2b70eb60-3b14-11ef-bc00-830443186a3f.jpg.webp,https://www.bbc.com/worklife/article/20240701-lindsey-vonn-interview-influential-katty-kay
1027,28 Jun 2024,Electric car battery charges in under five minutes in track test,The supermarket says most staff in line to receive a share of the windfall work on the shop floor.,England,https://ichef.bbci.co.uk/news/480/cpsprodpb/5a2a/live/1d5c3a40-3ae5-11ef-bbe0-29f79e992ddd.png.webp,https://www.bbc.com/news/articles/cz9dp3ye77do
1028,4 Jul 2024,Rare plants hidden in toys - and other trafficking tactics,Boeing is one of the largest and most important companies in the US but is it too big to be held to account?,Gloucestershire,https://ichef.bbci.co.uk/news/480/cpsprodpb/eda5/live/b3912c10-346d-11ef-9c36-8df29c2186ca.jpg.webp,https://www.bbc.com/news/articles/cd19x4qpw5qo
1029,8 Jul 2024,Missing 6th Century bucket pieces found at Sutton Hoo,"The cautious approach Labour took in the election campaign of not offering a lot cannot last into government, says the BBC's economics editor.",Gloucestershire,https://ichef.bbci.co.uk/news/480/cpsprodpb/4a8b/live/e37deb60-37c5-11ef-a044-9d4367d5b599.jpg.webp,https://www.bbc.com/news/articles/cmj2n7nz6zjo
1030,5 Jul 2024,"Over 20,000 Tesco staff to split £30m from share schemes",The university teamed up with three others in the US to achieve robotic hand dexterity.,Culture,https://ichef.bbci.co.uk/images/ic/480x270/p0j84gl4.jpg.webp,https://www.bbc.com/news/articles/c2e4nee6v8jo
1031,28 Jun 2024,What's the right punishment for 'too big to fail' Boeing?,"The party has pledged to reform the planning system, although some have warned that doing so will not be easy.",Wiltshire,https://ichef.bbci.co.uk/news/480/cpsprodpb/b72c/live/224dccf0-348a-11ef-a1a9-87b99e80208b.png.webp,https://www.bbc.com/news/articles/c6p2jeg14r9o
1032,5 Jul 2024,Labour must act now to reboot the economy,Many cruise companies are touting their green credentials. But can cruise ships ever be sustainable?,Business,https://ichef.bbci.co.uk/news/480/cpsprodpb/bb09/live/dccf8420-3957-11ef-bbe0-29f79e992ddd.jpg.webp,https://www.bbc.com/news/articles/cy68p4wnj9zo
1033,28 Jun 2024,University makes robotic hand 'breakthrough',Denmark were left rueing two VAR decisions as Germany won 2-0 to reach Euro 2024 quarter-finals.,Scotland,https://ichef.bbci.co.uk/news/480/cpsprodpb/ba19/live/2287bb20-34aa-11ef-951b-b76e5d261303.jpg.webp,https://www.bbc.com/news/articles/cz7e5rlk838o
1034,30 Jun 2024,Shares in housebuilders rise on back of Labour win,"Space launches are increasing and the rockets are getting bigger. What's the environmental impact on the surrounding areas, particularly when things go wrong?",Travel,https://ichef.bbci.co.uk/news/480/cpsprodpb/47e1/live/fdb2c690-3955-11ef-8678-672b03790cf6.jpg.webp,https://www.bbc.com/news/articles/cn08yw474q6o
1035,29 Jun 2024,Why cruising is worse than flying,"The party has pledged to reform the planning system, although some have warned that doing so will not be easy.",BBC InDepth,https://ichef.bbci.co.uk/news/480/cpsprodpb/eed5/live/6c3daaf0-3ae4-11ef-a044-9d4367d5b599.jpg.webp,https://www.bbc.com/future/article/20240627-are-green-cruise-ships-good-for-the-climate
1036,5 Jul 2024,'Decisive 16 seconds' from 'ridiculous' VAR as German 'belief' grows,"Families of the people who died on the flights five years ago have criticised it as a ""sweetheart deal"".",Wales,https://ichef.bbci.co.uk/news/480/cpsprodpb/2142/live/4be20420-3a9b-11ef-bfc3-b343fb6a27dd.jpg.webp,https://www.bbc.com/sport/football/articles/cy943e4wyj2o
1037,9 Jul 2024,The environmental cost of rocket launches,The new chancellor says Labour is ready to make tough decisions to boost the UK economy.,Business,https://ichef.bbci.co.uk/news/480/cpsprodpb/6462/live/15880500-3492-11ef-a732-21dac696873c.png.webp,https://www.bbc.com/future/article/20240627-the-environmental-cost-of-rocket-launches
1038,8 Jul 2024,Shares in housebuilders rise on back of Labour win,"The aquatic facility in Washington, near Steyning, has been set up in a former warehouse.",London,https://ichef.bbci.co.uk/news/480/cpsprodpb/c9bc/live/6fe6c6b0-3aed-11ef-9274-0f3adc594d24.jpg.webp,https://www.bbc.com/news/articles/cn08yw474q6o
1039,28 Jun 2024,Boeing to plead guilty to criminal fraud charge,"The regulator sets price limits for England and Wales, but water bills vary across the country.",Oxford,https://ichef.bbci.co.uk/images/ic/480x270/p0j6xgwy.jpg.webp,https://www.bbc.com/news/articles/cjjjj85z0lno
1040,11 Jul 2024,Reeves to bring back housebuilding targets,"The 1,650-tonne load pulls into the Ratcliffe-on-Soar site, bringing an era to an end.",Cumbria,https://ichef.bbci.co.uk/news/480/cpsprodpb/2829/live/8df702a0-366f-11ef-a044-9d4367d5b599.png.webp,https://www.bbc.com/news/articles/ckkg2l1rpr4o
1041,30 Jun 2024,Baby and toddler pool to open in former warehouse,"How to watch and listen to all the election coverage, reaction and analysis on BBC Scotland.",Technology,https://ichef.bbci.co.uk/images/ic/480x270/p0j6yh4n.jpg.webp,https://www.bbc.com/news/articles/c6p2r6p7x7no
1042,4 Jul 2024,Water bills: How much will I have to pay?,The new PM and his team face the huge responsibility that comes with being in power.,Cornwall,https://ichef.bbci.co.uk/news/480/cpsprodpb/c9bc/live/6fe6c6b0-3aed-11ef-9274-0f3adc594d24.jpg.webp,https://www.bbc.com/news/articles/cmm26e1qpzgo
1043,6 Jul 2024,Power station's last coal delivery arrives by rail,Webtoon Entertainment says it has 170m monthly active users in over 150 countries around the world.,England,https://ichef.bbci.co.uk/news/480/cpsprodpb/a6b0/live/83bb2100-3231-11ef-bc72-51b61c17135e.jpg.webp,https://www.bbc.com/news/articles/ckkg0wl7dkro
1044,27 Jun 2024,How BBC Scotland is covering the general election,Americans are taking loans to afford basic necessities - as groceries prices have surged by 25%.,Bradford,https://ichef.bbci.co.uk/news/480/cpsprodpb/0230/live/45447b00-3d18-11ef-b74c-bb483a802c97.jpg.webp,https://www.bbc.com/news/articles/cp38xnl6l53o
1045,8 Jul 2024,Inside Keir Starmer's preparations for power,The new chancellor says she has inherited a depleted economy that will create a “challenge” for Labour.,Wolverhampton,https://ichef.bbci.co.uk/news/480/cpsprodpb/1ee0/live/d5686da0-347a-11ef-a53b-67ee534ca28a.jpg.webp,https://www.bbc.com/news/articles/c725z55d75ko
1046,5 Jul 2024,Korean web comic giant set for $2.7bn market debut,"Tech firms commonly highlight their use of AI, but in some cases it may be exaggerated.",Asia,https://ichef.bbci.co.uk/news/480/cpsprodpb/c1dd/live/417b65e0-3f59-11ef-96a8-e710c6bfc866.jpg.webp,https://www.bbc.com/news/articles/c4nglpj3dllo
1047,27 Jun 2024,'I had to downgrade my life' - US workers in debt to buy groceries,The candidates standing in North Shropshire take part in an hour-long debate.,Business,https://ichef.bbci.co.uk/news/480/cpsprodpb/818e/live/964452c0-355f-11ef-b6d9-e13f185918e1.jpg.webp,https://www.bbc.com/news/articles/cx002795738o
1048,29 Jun 2024,Reeves: 'There's not a huge amount of money',Experts warn outdated NHS IT systems remain vulnerable after the cyber attack on hospitals.,Tees,https://ichef.bbci.co.uk/news/480/cpsprodpb/9206/live/1e88daa0-3788-11ef-9bca-0db727f63d54.png.webp,https://www.bbc.com/news/articles/cldyeykzp33o
1049,8 Jul 2024,What is 'AI washing' and why is it a problem?,"George Freeman is hoping to defend the seat he first won in 2010, but has fears things could be changing.",London,https://ichef.bbci.co.uk/news/480/cpsprodpb/6494/live/b5cd4360-3b52-11ef-bbe0-29f79e992ddd.png.webp,https://www.bbc.com/news/articles/c9xx8122893o
1050,2 Jul 2024,Four takeaways from North Shropshire debate,"Senior care worker Jade Coghlan said: ""Everyone's going all out - her face on that day is going to be absolutely priceless!"".",Future,https://ichef.bbci.co.uk/news/480/cpsprodpb/0dda/live/3712b860-344b-11ef-bd23-6d718bda4a50.jpg.webp,https://www.bbc.com/news/articles/c6p232dwdlyo
1051,3 Jul 2024,Fix NHS gaps or face more attacks - ex cyber chief,"The Bognor Regis Time Portal is in the final of the Auggie Awards, taking place in California.",Birmingham & Black Country,https://ichef.bbci.co.uk/news/480/cpsprodpb/418d/live/4d72f760-33d7-11ef-b3b2-c3ba2ab52d36.png.webp,https://www.bbc.com/news/articles/czd9glyx414o
1052,13 Jun 2024,Are voters in Conservative stronghold disillusioned?,Kellie Dingwall is one of a growing number of visually impaired people who are getting into online gaming.,Politics,https://ichef.bbci.co.uk/news/480/cpsprodpb/61be/live/2e5e9740-3ad9-11ef-bdc5-41d7421c2adf.jpg.webp,https://www.bbc.com/news/articles/c4ngzx4ev69o
1053,4 Jul 2024,'We want her to celebrate in style',Viruses have traditionally been named after the places or animals they have been first discovered in. Now scientists are trying to bring order to the chaos of virus naming.,Oxford,/bbcx/grey-placeholder.png,https://www.bbc.com/news/articles/c4ngzjdypw1o
1054,8 Jul 2024,‘Time portal’ attraction up for technology award,"North Korea says it succeeded in testing a multiple warhead missile, but the South and others are not convinced.",Business,https://ichef.bbci.co.uk/news/480/cpsprodpb/900d/live/70647aa0-3378-11ef-bdc5-41d7421c2adf.jpg.webp,https://www.bbc.com/news/articles/cw448vrny9lo
1055,29 Jun 2024,Blind gamers say accessibility is a 'must-have',Three Scottish brothers want to become the fastest team to row across the Pacific Ocean.,Guernsey,https://ichef.bbci.co.uk/news/480/cpsprodpb/ae43/live/656912b0-3552-11ef-9e36-cb7b9a68823b.jpg.webp,https://www.bbc.com/news/articles/c3gw6v1ljnpo
1056,15 Jun 2024,Why scientists are renaming deadly viruses,"Several people have told the BBC they are still facing issues, with some saying they have little cash left.",World,https://ichef.bbci.co.uk/news/480/cpsprodpb/b8c7/live/1d608870-3a13-11ef-8147-b71ad54f8e8a.png.webp,https://www.bbc.com/future/article/20240705-how-the-dengue-virus-got-its-name
1057,28 Jun 2024,North Korea says it fired a new weapon - is it lying?,Shares in the US-based electric truck and SUV maker jumped by almost 50% after the announcement.,Glasgow & West Scotland,/bbcx/grey-placeholder.png,https://www.bbc.com/news/articles/cxx2g3524p2o
1058,26 Jun 2024,We want to smash the Pacific rowing record - using F1 technology,Water firms have hit out at bill rises of £94 over the next five years after wanting bigger hikes.,Devon,https://ichef.bbci.co.uk/news/480/cpsprodpb/b359/live/35bfb660-37cb-11ef-9503-13155bde1b4d.jpg.webp,https://www.bbc.com/news/articles/crggnr0pr7do
1059,11 Jul 2024,Major UK high street banks say payment issues fixed,Three Scottish brothers want to become the fastest team to row across the Pacific Ocean.,Future,https://ichef.bbci.co.uk/news/480/cpsprodpb/17e4/live/e968f7a0-391d-11ef-85ba-e5e081cb6e53.jpg.webp,https://www.bbc.com/news/articles/c3g03ejjl1yo
1060,15 Jun 2024,VW to invest up to $5bn in Tesla rival Rivian,"How they maintain the historic wettest, lowest, and once longest rail tunnel in the UK.",Devon,https://ichef.bbci.co.uk/news/480/cpsprodpb/db3c/live/dbc5ba00-28a8-11ef-bb30-4b949fc56ef4.jpg.webp,https://www.bbc.com/news/articles/c1ddmxmz1lpo
1061,4 Jul 2024,Row over rise in water bills as firms say it's not enough,"Millions of tonnes of fireworks are set off each year to mark Independence Day in the US, causing air pollution to spike. Should you be worried?",London,https://ichef.bbci.co.uk/news/480/cpsprodpb/6384/live/523d3f70-3531-11ef-8d9b-696600cc4e6c.jpg.webp,https://www.bbc.com/news/articles/cyx0jxrq7y4o
1062,4 Jul 2024,We want to smash the Pacific rowing record - using F1 technology,"Several people have told the BBC they are still facing issues, with some saying they have little cash left.",Future,https://ichef.bbci.co.uk/images/ic/480x270/p0j8pj6y.jpg.webp,https://www.bbc.com/news/articles/crggnr0pr7do
1063,28 Jun 2024,"The tunnel that links beer, Scuba diving and Oasis",Young students in Liskeard have taken part in a police-led workshop on how to stay safe online.,Business,https://ichef.bbci.co.uk/news/480/cpsprodpb/74d7/live/571b0210-3523-11ef-bbe0-29f79e992ddd.jpg.webp,https://www.bbc.com/news/articles/c3gwp6lz2v8o
1064,29 Jun 2024,Why air quality drops around 4 July,Plymouth resident Linda Eastlake said central government should be responsible for the toll.,Politics,https://ichef.bbci.co.uk/news/480/cpsprodpb/8e77/live/f32be630-2806-11ef-a696-6177220021da.jpg.webp,https://www.bbc.com/future/article/20240703-how-4-july-fireworks-pollute-the-air-and-might-damage-your-health
1065,29 Jun 2024,Major UK high street banks say payment issues fixed,"""Sail fast, then wait"" is a common motto in some parts of the shipping industry, but some ships are making the bold move of slowing down to save money and emissions.",US & Canada,https://ichef.bbci.co.uk/news/480/cpsprodpb/91a7/live/a0049eb0-355e-11ef-b6d9-e13f185918e1.jpg.webp,https://www.bbc.com/news/articles/c3g03ejjl1yo
1066,3 Jul 2024,Pupils taught dangers of sharing indecent photos,New technology promises TV and phone screens that use much less electricity than current models.,England,https://ichef.bbci.co.uk/news/480/cpsprodpb/489d/live/675eb070-334a-11ef-a338-cff579e52648.jpg.webp,https://www.bbc.com/news/articles/cleeyjn6v37o
1067,25 Jun 2024,"Your Voice, Your Vote: Abolish Tamar Bridge toll",Tim Parker says he did not share a report with the Post Office board following advice from lawyers.,Science & Environment,https://ichef.bbci.co.uk/news/480/cpsprodpb/c165/live/b2de7ba0-3ee6-11ef-9e1c-3b4a473456a6.jpg.webp,https://www.bbc.com/news/articles/c80xlx48g5eo
1068,3 Jul 2024,The obvious idea that slashes shipping's emissions,"In her maiden speech in the Commons in 2010, she vowed to fight for ""jobs, growth and prosperity"".",Somerset,https://ichef.bbci.co.uk/news/480/cpsprodpb/8e77/live/f32be630-2806-11ef-a696-6177220021da.jpg.webp,https://www.bbc.com/future/article/20240702-climate-change-how-slowing-down-shipping-could-save-emissions
1069,5 Jul 2024,The screen tech that can do almost anything,The cameras will be installed in areas blighted by anti-social behaviour across Castle Point.,Business,https://ichef.bbci.co.uk/news/480/cpsprodpb/b9a1/live/ce4ad840-39da-11ef-a044-9d4367d5b599.jpg.webp,https://www.bbc.com/news/articles/c4nn6z6z4ypo
1070,26 Jun 2024,Ex-Post Office chair denies hiding key Horizon report,The 'Reach for the Sky' event took place in a hanger at RNAS Culdrose on Saturday.,Business,https://ichef.bbci.co.uk/images/ic/480x270/p0j827l1.jpg.webp,https://www.bbc.com/news/articles/cyr7kz30jnpo
1071,25 Jun 2024,Rachel Reeves: Who is the UK's new chancellor?,"Tubi will offer more than 20,000 films and TV series, including Hollywood titles and British content.",Technology,https://ichef.bbci.co.uk/news/480/cpsprodpb/91a7/live/a0049eb0-355e-11ef-b6d9-e13f185918e1.jpg.webp,https://www.bbc.com/news/articles/cw4ywl7w820o
1072,2 Jul 2024,CCTV investment is 'game changer' for Castle Point,"Sam Russell says it is ""astounding"" that existing technology is so difficult for many people to use.",US & Canada,https://ichef.bbci.co.uk/news/480/cpsprodpb/8a5e/live/03a8ef90-33cd-11ef-a508-e1cdd362243c.jpg.webp,https://www.bbc.com/news/articles/c6pp26wwqjqo
1073,25 Jun 2024,Hundreds of girls attend engineering festival,Prof Patricia Wiltshire tells Desert Island Discs the murder of Michelle Bettles stayed with her.,England,https://ichef.bbci.co.uk/news/480/cpsprodpb/f503/live/914349d0-27fd-11ef-baa7-25d483663b8e.png.webp,https://www.bbc.com/news/articles/c7222mj8zlko
1074,30 Jun 2024,Fox set to launch free Netflix rival in UK,The country says the policy will help boost economic growth.,Science & Environment,https://ichef.bbci.co.uk/images/ic/480x270/p0j7xnq3.jpg.webp,https://www.bbc.com/news/articles/cn385lgk0vjo
1075,3 Jul 2024,Smart speaker device designed by deaf student,Currys and John Lewis say bigger TVs have proved popular with customers due to the tournament.,Wales,https://ichef.bbci.co.uk/news/480/cpsprodpb/5f71/live/d7d07e10-2d55-11ef-90be-b75b34b0bbb2.jpg.webp,https://www.bbc.com/news/articles/c3ggg8d58j7o
1076,27 Jun 2024,Unsolved murder of mother-of-three affected expert,"As effluent from sewage works and agricultural pollution flow freely into rivers, researchers and local citizens are urgently seeking to clean up the UK's waterways.",Cambridgeshire,https://ichef.bbci.co.uk/news/480/cpsprodpb/4044/live/55fe7c50-3946-11ef-a044-9d4367d5b599.jpg.webp,https://www.bbc.com/news/articles/c9e9vrxgyv4o
1077,5 Jul 2024,Greece starts six-day working week for some industries,Lloyds has become the latest bank to announce it is closing its branch.,Wales,https://ichef.bbci.co.uk/news/480/cpsprodpb/19f1/live/b3bb2520-3ab6-11ef-b2fb-b1658f4bc7c2.jpg.webp,https://www.bbc.com/news/articles/czd9g7yzn4jo
1078,28 Jun 2024,'Supersize' TV sales shoot up thanks to Euro 2024,"Hurricane Beryl, the first category five storm of 2024, could be a sign of what is to come.",Business,https://ichef.bbci.co.uk/news/480/cpsprodpb/df4f/live/79111000-33a0-11ef-8699-9f505da6f2b0.png.webp,https://www.bbc.com/news/articles/cqv5dww0w9do
1079,3 Jul 2024,Cleaning up the UK's sewage-infested hotspots,Currys and John Lewis say bigger TVs have proved popular with customers due to the tournament.,Newsbeat,https://ichef.bbci.co.uk/news/480/cpsprodpb/c828/live/b59bd940-3235-11ef-bc72-51b61c17135e.jpg.webp,https://www.bbc.com/future/article/20240704-the-wetlands-cleaning-up-the-uks-sewage-pollution
1080,27 Jun 2024,Town to be left with no high street bank,"Tallulah Martinez, 17, from Hastings wins Bafta's Game Concept Award for 15 to 18-year-olds",Future,https://ichef.bbci.co.uk/news/480/cpsprodpb/6732/live/2531f770-3877-11ef-8a0a-5d92815c72ec.png.webp,https://www.bbc.com/news/articles/c29dgd73l4ro
1081,2 Jul 2024,What happens when hurricanes rapidly intensify,Owners of adjacent waterways or even members of the public could now bring action over sewage pollution.,Newsbeat,https://ichef.bbci.co.uk/news/480/cpsprodpb/79db/live/e8dac0c0-321f-11ef-9c8c-fb8c1c7c7566.jpg.webp,https://www.bbc.com/future/article/20230911-what-a-record-breaking-hurricane-looks-like
1082,3 Jul 2024,'Supersize' TV sales shoot up thanks to Euro 2024,"Manx has seen a revival since the death of the last native speaker, Ned Maddrell, in 1974.",Politics,https://ichef.bbci.co.uk/news/480/cpsprodpb/a402/live/6165a020-3584-11ef-bdc5-41d7421c2adf.jpg.webp,https://www.bbc.com/news/articles/cqv5dww0w9do
1083,28 Jun 2024,Hastings girl wins prestigious game design award,The note helped persuade President Roosevelt the US should develop the world's first nuclear weapons.,Norfolk,https://ichef.bbci.co.uk/news/480/cpsprodpb/3438/live/2f231950-3924-11ef-85ba-e5e081cb6e53.jpg.webp,https://www.bbc.com/news/articles/cpwdqlqx0v6o
1084,25 Jun 2024,Water firms could be sued over sewage after ruling,"With the group stage completed, BBC Sport takes a look at five things we have learned from the competition in Germany so far.",England,https://ichef.bbci.co.uk/news/480/cpsprodpb/ad40/live/af690100-347f-11ef-a53b-67ee534ca28a.jpg.webp,https://www.bbc.com/news/articles/cv2gmx8d51xo
1085,27 Jun 2024,Manx language added to Google Translate,The majority of secondary schools in the islands have policies to prohibit or limit their use.,Berkshire,https://ichef.bbci.co.uk/images/ic/480x270/p0j8bk7l.jpg.webp,https://www.bbc.com/news/articles/c0xjp03yq0lo
1086,26 Jun 2024,Einstein atomic bomb letter to be auctioned,Food sales rise but the soggy spring hits demand for garden equipment and outdoor furniture,Asia,https://ichef.bbci.co.uk/news/480/cpsprodpb/2878/live/5bde0790-3553-11ef-9e36-cb7b9a68823b.png.webp,https://www.bbc.com/news/articles/cxxxx1w9znko
1087,2 Jul 2024,What we have learned from the Euro 2024 group stage,"Steven Rose was a friend of 25-year-old Tom Ellis, who died after being stabbed in Nuneaton.",Business,https://ichef.bbci.co.uk/images/ic/480x270/p0gcyq88.jpg.webp,https://www.bbc.com/sport/football/articles/cgrrlx1nn2eo
1088,28 Jun 2024,"Banning smartphones helps learning, say educators",It is the first time a company has been found to be in breach of the Digital Markets Act (DMA).,West Yorkshire,https://ichef.bbci.co.uk/news/480/cpsprodpb/ad40/live/af690100-347f-11ef-a53b-67ee534ca28a.jpg.webp,https://www.bbc.com/news/articles/c2ee4ndpd3lo
1089,24 Jun 2024,Sainsbury's hit as wet weather dampens Argos sales,"Buffalo, New York, is one of a growing number of cities to embrace the idea of being a climate refuge, but can they actually protect residents from extreme weather?",Dorset,https://ichef.bbci.co.uk/news/480/cpsprodpb/9837/live/afa16cb0-355c-11ef-997b-4db56f259e3a.jpg.webp,https://www.bbc.com/news/articles/cv2g0w81e45o
1090,1 Jul 2024,Politicians quizzed by friend of stabbing victim,Bids for dozens of the poles are turned down amid concerns about their appearance and impact on nature.,Politics,https://ichef.bbci.co.uk/news/480/cpsprodpb/ce4e/live/f71ba3e0-3952-11ef-8a7f-d3ef80139930.jpg.webp,https://www.bbc.com/news/articles/c727l2y0grxo
1091,25 Jun 2024,"Apple in breach of law on App Store, says EU",How do you use up left overs? Have you ever thought of making your own crisps from potato skins?,Politics,https://ichef.bbci.co.uk/news/480/cpsprodpb/89cc/live/9bc2cff0-3556-11ef-a126-77103f0ce045.jpg.webp,https://www.bbc.com/news/articles/c5111qxl2nro
1092,29 Jun 2024,These cities claim to be 'climate havens',Gareth Jenkins says he felt pressure from the Post Office over evidence he gave in the trial of Seema Misra.,Politics,https://ichef.bbci.co.uk/news/480/cpsprodpb/1e42/live/61e46e20-3244-11ef-a044-9d4367d5b599.jpg.webp,https://www.bbc.com/future/article/20240628-us-climate-havens-cities-claim-extreme-weather-protection
1093,27 Jun 2024,Fibre-broadband telegraph pole plans rejected,Retired South Yorkshire Police detectives revisit murder and sexual assault cases using new technology.,Business,https://ichef.bbci.co.uk/news/480/cpsprodpb/664d/live/e87fba60-348e-11ef-a732-21dac696873c.png.webp,https://www.bbc.com/news/articles/c6ppp427lqqo
1094,23 Jun 2024,Pupils cook up award-winning food waste recipe book,"Dave Ricks says he had considered building a factory in the UK, but chose another country instead.",Technology,https://ichef.bbci.co.uk/news/480/cpsprodpb/7c88/live/cd0e2730-3303-11ef-9f4c-8785b0c18838.jpg.webp,https://www.bbc.com/news/articles/cg3jv8l46xno
1095,1 Jul 2024,IT expert 'pressurised' by Post Office over evidence,Voters who have contacted the BBC explain why they want candidates to concentrate on crime.,Cambridgeshire,https://ichef.bbci.co.uk/news/480/cpsprodpb/a687/live/815989d0-3851-11ef-8c4c-0b2da78a9418.jpg.webp,https://www.bbc.com/news/articles/c3gvxdlrgw0o
1096,29 Jun 2024,The cold case unit solving crimes from the 1960s,"Dave Ricks says he had considered building a factory in the UK, but chose another country instead.",Business,https://ichef.bbci.co.uk/news/480/cpsprodpb/7fe3/live/5c025ca0-354c-11ef-bdc5-41d7421c2adf.png.webp,https://www.bbc.com/news/articles/c2qqele007zo
1097,1 Jul 2024,"UK planning laws deter investment, says drugs giant","Sony, Universal and Warner claim AI software steals music to ""spit out"" similar work.",World,https://ichef.bbci.co.uk/news/480/cpsprodpb/26d8/live/d38a6fc0-3212-11ef-a0f4-1b104ecf2771.jpg.webp,https://www.bbc.com/news/articles/c4ngq10grgzo
1098,26 Jun 2024,"Your Voice, Your Vote: 'Crime is our priority for politicians'","Ellen Morgan, 50, is calling for further investment to be put into carers services.",Somerset,https://ichef.bbci.co.uk/images/ic/480x270/p0j701p5.jpg.webp,https://www.bbc.com/news/articles/ck55gz98d4po
1099,2 Jul 2024,"UK planning laws deter investment, says drugs giant",The woman sustained serious injuries in the accident at Archway London Underground station.,England,https://ichef.bbci.co.uk/news/480/cpsprodpb/8b6c/live/84e018f0-32f5-11ef-923c-8db5cc89ef45.jpg.webp,https://www.bbc.com/news/articles/c4ngq10grgzo
