,time_ago,titles,subtitles,location,images,Links
0,4 days ago,Music technology project teaches teens life skills,Teenagers at an Ennerdale Bridge venue learn the technology to put on professional live stage shows.,Cumbria,https://ichef.bbci.co.uk/news/480/cpsprodpb/f3ec/live/44043130-6488-11ef-a742-630667543078.jpg.webp,https://www.bbc.com/news/articles/c17gzgyr1l1o
1,5 days ago,Maternity ward to pilot new cataract technology,A new device which could help diagnose cataracts in newborn babies is being piloted in Poole.,Dorset,https://ichef.bbci.co.uk/news/480/cpsprodpb/3e83/live/63398650-63a6-11ef-a3be-9d22df5b2625.jpg.webp,https://www.bbc.com/news/articles/c0rw9ve8rqro
2,22 Aug 2024,Hospitals keep AI technology after cancer trial,"The technology detects more potentially cancerous bowel lesions, experts say.",England,https://ichef.bbci.co.uk/news/480/cpsprodpb/c525/live/bb4b1eb0-6074-11ef-aea1-e764981585c4.jpg.webp,https://www.bbc.com/news/articles/cvg3r35j04po
3,20 Aug 2024,The mind-bending mirrors behind advanced technology,"Huge, tiny or incredibly flat, advanced mirrors are essential to high-tech machines.",Europe,https://ichef.bbci.co.uk/news/480/cpsprodpb/51ca/live/6949ec50-3dd7-11ef-9e1c-3b4a473456a6.jpg.webp,https://www.bbc.com/news/articles/cd1646ewzleo
4,20 Aug 2024,"AI technology keeps 6,000 deer from rail routes",The system was installed as part of a trial in Grantham and Stoke-on-Trent.,Technology,https://ichef.bbci.co.uk/news/480/cpsprodpb/d641/live/7385d8c0-5ec3-11ef-bc34-c73f4d0aa7c3.jpg.webp,https://www.bbc.com/news/articles/ckg5l4jq231o
5,1 Aug 2024,Can technology fix the 'broken' concert ticketing system?,The increased use of AI may prevent tickets being resold at excessively high prices.,Wales,https://ichef.bbci.co.uk/news/480/cpsprodpb/4f57/live/21801850-4a65-11ef-935f-59cf6f181f38.jpg.webp,https://www.bbc.com/news/articles/cml2p8nvzp9o
6,18 Jul 2024,How technology will power the opening ceremony,A new network along the Seine in Paris will broadcast Olympic festivities from the river.,Manchester,https://ichef.bbci.co.uk/images/ic/480x270/p0jbv15z.jpg.webp,https://www.bbc.com/reel/video/p0jbtxqr/how-technology-will-power-the-opening-ceremony
7,4 days ago,Drones deliver packages to remote parts of Wales,Manufacturers are testing out technology to help deliver critical parcels by drone.,Business,https://ichef.bbci.co.uk/news/480/cpsprodpb/a010/live/63b683c0-6541-11ef-93e5-dd4bf8468803.jpg.webp,https://www.bbc.com/news/articles/c17gznrqnk7o
8,2 days ago,AI cameras to spot region's drivers on phones,The artificial intelligence technology detects potential offending drivers before a final human check.,Gloucestershire,https://ichef.bbci.co.uk/news/480/cpsprodpb/e72f/live/36189ce0-660f-11ef-a04d-25d7e12eecf1.jpg.webp,https://www.bbc.com/news/articles/cged890y27wo
9,7 days ago,Have supermarkets reached peak self-scan?,Supermarkets are beginning to question the divisive technology after years of criticism from shoppers.,Hull & East Yorkshire,https://ichef.bbci.co.uk/news/480/cpsprodpb/2751/live/03dffa70-5ed5-11ef-8946-5dee0275025b.jpg.webp,https://www.bbc.com/news/articles/cj08m35q3l9o
10,21 Aug 2024,Former nuclear power station site sold for £6.5m,The owners plan to redevelop the site for a new kind of nuclear technology.,Essex,https://ichef.bbci.co.uk/news/480/cpsprodpb/ef68/live/ae3aa720-5f95-11ef-a92e-db63b635ebfb.jpg.webp,https://www.bbc.com/news/articles/c1m0pgvmdrgo
11,4 days ago,New tech removes need for cancer patient tattoos,A £1.4m investment is being made into new radiotherapy technology at Hull's Castle Hill Hospital.,Scotland,https://ichef.bbci.co.uk/news/480/cpsprodpb/a82f/live/827d6b20-6519-11ef-aa02-77f1a7028b9d.jpg.webp,https://www.bbc.com/news/articles/c3rd1vy4p0eo
12,8 days ago,Live facial recognition cameras used for first time,The cameras will be deployed to other areas of the county this weekend after a successful first use of them.,Innovation,https://ichef.bbci.co.uk/news/480/cpsprodpb/c5ca/live/e2de5eb0-6204-11ef-827d-7795342cfd7d.jpg.webp,https://www.bbc.com/news/articles/cx29dy943qqo
13,21 Aug 2024,Drones fly NHS lab specimens in Scottish first,The delivery flew about 30 miles between Edinburgh and Melrose to test out the technology.,Gloucestershire,https://ichef.bbci.co.uk/news/480/cpsprodpb/8922/live/a9d121c0-5fb1-11ef-b56c-b1ea4410f82c.jpg.webp,https://www.bbc.com/news/articles/ce38jy1723yo
14,2 days ago,How beer is used to make alternative leather,"The grain left from beer production is being used to make alternative leather. So, how does the technology work?",Europe,https://ichef.bbci.co.uk/images/ic/480x270/p0jjvq6j.jpg.webp,https://www.bbc.com/reel/video/p0jjvhkd/how-beer-is-used-to-make-alternative-leather
15,22 Aug 2024,Funding of £38k to help council tackle fly-tipping,Cotswold District Council will use it for a public campaign and better technology to catch offenders.,Business,https://ichef.bbci.co.uk/news/480/cpsprodpb/94c9/live/50120830-5bd7-11ef-824d-3d48c279d1e3.jpg.webp,https://www.bbc.com/news/articles/cvg3prrwk4yo
16,3 days ago,Ukraine's long-range drones using Western tech to hit Russia,Western technology and finance are helping Ukraine carry out hundreds of long-range strikes inside Russia.,Business,https://ichef.bbci.co.uk/news/480/cpsprodpb/1a04/live/e1c81760-655f-11ef-9851-c5606b77a2fd.png.webp,https://www.bbc.com/news/articles/c6240qepyppo
17,3 days ago,AI chip giant Nvidia shares fall despite record sales,The California-based technology giant has been one of the biggest beneficiaries of the AI boom.,Cumbria,https://ichef.bbci.co.uk/news/480/cpsprodpb/9f33/live/5f9e97a0-659b-11ef-99ae-29134c8b0f37.jpg.webp,https://www.bbc.com/news/articles/c984jrj24wyo
18,3 days ago,AI chip giant Nvidia shares fall despite record sales,The California-based technology giant has been one of the biggest beneficiaries of the AI boom.,Technology,https://ichef.bbci.co.uk/news/480/cpsprodpb/9f33/live/5f9e97a0-659b-11ef-99ae-29134c8b0f37.jpg.webp,https://www.bbc.com/news/articles/c984jrj24wyo
19,22 Aug 2024,Town's Innovation Centre plans approved,Preparatory work for the four-storey building is under way and it is due to open by early 2026.,Business,https://ichef.bbci.co.uk/news/480/cpsprodpb/1471/live/da7b6250-6064-11ef-b970-9f202720b57a.png.webp,https://www.bbc.com/news/articles/cp3de31wr06o
20,23 Aug 2024,Tributes paid to 'UK's greatest tech entrepreneur',"A leading figure in the UK tech scene, Mike Lynch died shortly after winning a legal battle in the US.",Wear,https://ichef.bbci.co.uk/news/480/cpsprodpb/31d9/live/3f7c44f0-609f-11ef-b970-9f202720b57a.jpg.webp,https://www.bbc.com/news/articles/cdxl5kpvrg9o
21,5 days ago,UK to spend £10.5m on new EU border checks,Travellers from the UK and other non-EU countries will soon have to go through a new digital border system.,Stoke & Staffordshire,https://ichef.bbci.co.uk/news/480/cpsprodpb/45fd/live/cb802730-6466-11ef-b2e6-ff1dccf4865c.jpg.webp,https://www.bbc.com/news/articles/c4gz9n06rxdo
22,23 Aug 2024,Families 'struggling' without internet due to bills,The North East has the highest number of residents without internet in their own home in England.,Technology,https://ichef.bbci.co.uk/news/480/cpsprodpb/916a/live/ab4304a0-5fda-11ef-8b3a-855e585a4dd6.png.webp,https://www.bbc.com/news/articles/c74jzz19783o
23,15 Aug 2024,Plans to regenerate historic pottery site approved,The council backs plans to turn the former potbank into a creative technology hub.,Kent,https://ichef.bbci.co.uk/news/480/cpsprodpb/aa88/live/cfa8f370-5b1d-11ef-861f-2b8366403252.jpg.webp,https://www.bbc.com/news/articles/c4gz8lp29reo
24,17 Aug 2024,Sunderland 5G mast plans approved,"An existing mast in the Pallion area will be made bigger, and 5G technology added.",Technology,https://ichef.bbci.co.uk/news/480/cpsprodpb/a4f9/live/8118b750-5bdf-11ef-824d-3d48c279d1e3.png.webp,https://www.bbc.com/news/articles/c0k4xepdy8do
25,4 days ago,Klarna: AI lets us cut thousands of jobs - but pay more,"The firm wants to reduce staff levels to 2,000 works through its use of AI in marketing and customer service.",Technology,https://ichef.bbci.co.uk/news/480/cpsprodpb/c63a/live/fd13e7f0-651a-11ef-be1a-47dbeb9bfccf.jpg.webp,https://www.bbc.com/news/articles/c80e1gp9m9zo
26,22 Aug 2024,Kent pupils celebrate GCSE success,Students in Kent have been joining others across the country in receiving their GCSE results.,Technology,https://ichef.bbci.co.uk/news/480/cpsprodpb/9975/live/a9b12220-606b-11ef-89d9-cf0afdbdfcb1.jpg.webp,https://www.bbc.com/news/articles/cn4974nv34ko
27,20 Aug 2024,"Drone swarms could stop wildfires, researchers say",UK researchers hope swarms of up to 30 aircraft using AI could put out flames before they spread.,Technology,https://ichef.bbci.co.uk/news/480/cpsprodpb/47ec/live/5c9ed1e0-5e58-11ef-b43e-6916dcba5cbf.jpg.webp,https://www.bbc.com/news/articles/cg3e4pw294po
28,3 days ago,Who is Pavel Durov and what is Telegram?,"Telegram is one of the world's most popular apps where groups of up to 200,000 users can exchange messages.",Technology,https://ichef.bbci.co.uk/news/480/cpsprodpb/1adc/live/43a7f890-63a5-11ef-a3be-9d22df5b2625.jpg.webp,https://www.bbc.com/news/articles/cx2x5yw8z7yo
29,5 days ago,Zuckerberg regrets bowing to Biden 'pressure' over Covid,The billionaire says White House officials pressured Meta to remove content 'for months' in 2021.,US & Canada,https://ichef.bbci.co.uk/news/480/cpsprodpb/e1db/live/659aed50-6453-11ef-91f3-273f9f80a920.jpg.webp,https://www.bbc.com/news/articles/czxlpjlgdzjo
30,4 days ago,Can Barbie help beat teen smartphone addiction?,Manufacturer HMD says it is trying to help people who want less 'digital impact' in their lives.,Asia,https://ichef.bbci.co.uk/news/480/cpsprodpb/901f/live/87ba6300-6482-11ef-827b-e3db9c05b116.png.webp,https://www.bbc.com/news/articles/cx2x52y0wv4o
31,4 days ago,Klarna: AI lets us cut thousands of jobs - but pay more,"The firm wants to reduce staff levels to 2,000 works through its use of AI in marketing and customer service.",Technology,https://ichef.bbci.co.uk/news/480/cpsprodpb/c63a/live/fd13e7f0-651a-11ef-be1a-47dbeb9bfccf.jpg.webp,https://www.bbc.com/news/articles/c80e1gp9m9zo
32,21 Aug 2024,London through the ages inspires Civilization VII,An eight-year wait for news on the next Civilization game is finally over.,Technology,https://ichef.bbci.co.uk/news/480/cpsprodpb/8f10/live/5e9f7a30-5fd4-11ef-b970-9f202720b57a.jpg.webp,https://www.bbc.com/news/articles/c8dp64e0r85o
33,21 Aug 2024,ChatGPT firm OpenAI strikes deal with Vogue owner,The multi-year deal is the latest such agreement to be struck between OpenAI and a major media company.,Surrey,https://ichef.bbci.co.uk/news/480/cpsprodpb/62af/live/78563b60-5f59-11ef-b96a-9d9c7f5b25ee.jpg.webp,https://www.bbc.com/news/articles/cpqjvl9z9w1o
34,22 Aug 2024,Top US college says diversity slumps after affirmative action ban,MIT says intake of some minority groups has fallen from 25% to 16% in one year after a Supreme Court decision.,Technology,https://ichef.bbci.co.uk/news/480/cpsprodpb/c593/live/d29fa110-6166-11ef-b4f3-d9f05349be86.jpg.webp,https://www.bbc.com/news/articles/c8rxvd2z6ldo
35,23 Aug 2024,When vets are scarce what can farmers do?,In Vietnam farmers are being encouraged to track the use of antibiotics and monitor disease.,Wales,https://ichef.bbci.co.uk/news/480/cpsprodpb/1cfc/live/5984cae0-44e1-11ef-96a8-e710c6bfc866.jpg.webp,https://www.bbc.com/news/articles/ce58nvdg327o
36,4 days ago,Can Barbie help beat teen smartphone addiction?,Manufacturer HMD says it is trying to help people who want less 'digital impact' in their lives.,Technology,https://ichef.bbci.co.uk/news/480/cpsprodpb/901f/live/87ba6300-6482-11ef-827b-e3db9c05b116.png.webp,https://www.bbc.com/news/articles/cx2x52y0wv4o
37,16 Aug 2024,Fortnite app returns to iPhones - but only in the EU,The boss of the game's publisher says he hopes to bring it to UK iPhones in 2025.,Technology,https://ichef.bbci.co.uk/news/480/cpsprodpb/9844/live/9f697060-5bcf-11ef-99f7-3dae98c58eb1.jpg.webp,https://www.bbc.com/news/articles/c70j5rx72yvo
38,4 days ago,"Film studio launches £250,000 education fund",Shepperton Studios will support education in film and media for young people in Spelthorne.,Tennis,https://ichef.bbci.co.uk/news/480/cpsprodpb/8f82/live/8f99fb40-6535-11ef-afd2-8d79aeaa745d.jpg.webp,https://www.bbc.com/news/articles/cd6yw761pzdo
39,16 Aug 2024,Testing out smart swim goggles for the Paris Games,A new generation of smart goggles provide real time visual feedback to enhance athletic performance.,Tennis,https://ichef.bbci.co.uk/images/ic/480x270/p0jjntzt.jpg.webp,https://www.bbc.com/reel/video/p0jjnj0l/testing-out-smart-swim-goggles-for-the-paris-games
40,14 Aug 2024,Watch as thief burgles a playgroup,A thief broke in to a playgroup in Blackwood and stole about £500 worth of technology.,South Yorkshire,https://ichef.bbci.co.uk/news/480/cpsprodpb/83e1/live/9e7226c0-5a1c-11ef-8f0f-0577398c3339.jpg.webp,https://www.bbc.com/news/articles/c62rxjy2gn2o
41,21 Aug 2024,Venue trials app for partially sighted visitors,A series of QR codes can be scanned for more information on the property's gardens.,Business,https://ichef.bbci.co.uk/news/480/cpsprodpb/f001/live/538d5bf0-5efb-11ef-bfa4-71cd40e04d31.jpg.webp,https://www.bbc.com/news/articles/cvgx12wgjyxo
42,22 Aug 2024,Dad hacks database to fake death and avoid child support pay,"The man, from Kentucky, has been jailed for what a judge in the US called his ""cynical"" actions.",Technology,https://ichef.bbci.co.uk/news/480/cpsprodpb/596a/live/eb9d4ce0-6066-11ef-89d9-cf0afdbdfcb1.png.webp,https://www.bbc.com/news/articles/cgrj9r5qpego
43,21 Aug 2024,Disney drops bid to stop allergy death lawsuit over Disney+ terms,The firm had argued the case should go to arbitration because of its streaming service's small print.,Liverpool,https://ichef.bbci.co.uk/news/480/cpsprodpb/559c/live/7c8673d0-5ee6-11ef-95f0-03cd55644816.jpg.webp,https://www.bbc.com/news/articles/cr7r9djxj0do
44,7 days ago,Difficult to have integrity questioned - Draper,"British number one Jack Draper says he endured a ""difficult"" time after having his integrity questioned following a controversial win.",Technology,https://ichef.bbci.co.uk/news/480/cpsprodpb/a200/live/ccdf79f0-62c2-11ef-ac2f-d129c54d1c74.jpg.webp,https://www.bbc.com/sport/tennis/articles/cm2nlpllzr9o
45,21 Aug 2024,Venue trials app for partially sighted visitors,A series of QR codes can be scanned for more information on the property's gardens.,Technology,https://ichef.bbci.co.uk/news/480/cpsprodpb/f001/live/538d5bf0-5efb-11ef-bfa4-71cd40e04d31.jpg.webp,https://www.bbc.com/news/articles/cvgx12wgjyxo
46,7 days ago,Difficult to have integrity questioned - Draper,"British number one Jack Draper says he endured a ""difficult"" time after having his integrity questioned following a controversial win.",Wear,https://ichef.bbci.co.uk/news/480/cpsprodpb/a200/live/ccdf79f0-62c2-11ef-ac2f-d129c54d1c74.jpg.webp,https://www.bbc.com/sport/tennis/articles/cm2nlpllzr9o
47,9 Aug 2024,Tour bus simulates dementia to help understanding,The bus uses technology to help people experience what dementia is like.,Business,https://ichef.bbci.co.uk/news/480/cpsprodpb/93c1/live/d0809210-54b7-11ef-b39c-e325fe012747.jpg.webp,https://www.bbc.com/news/articles/clyl3q85025o
48,16 Aug 2024,Is this the end for the magnetic stripe?,Once common on tickets and cardkeys the magnetic stripe is being phased out.,Nottingham,https://ichef.bbci.co.uk/news/480/cpsprodpb/db79/live/da0e18a0-5b21-11ef-8f0f-0577398c3339.jpg.webp,https://www.bbc.com/news/articles/c51yd4j4lnvo
49,15 Aug 2024,Tech firm apologises for 'creepy' hostess lampshade outfits,"The company-branded lampshades, which obscured the women's faces, have been called ""creepy"" and ""sexist.""",Culture,https://ichef.bbci.co.uk/news/480/cpsprodpb/b9b6/live/52467ad0-5b1b-11ef-9256-fbeae1bb95b3.jpg.webp,https://www.bbc.com/news/articles/c5y5r11xmkvo
50,7 days ago,EE tells parents: don't give under-11s smartphones,The mobile phone network recommends parents buy under-11s phones that can only text or call.,West Yorkshire,https://ichef.bbci.co.uk/news/480/cpsprodpb/badd/live/fc912390-62ce-11ef-b1a0-5377375b57ce.jpg.webp,https://www.bbc.com/news/articles/c4gvpy3yz1yo
51,13 Aug 2024,City to pilot 'super-smart' solar bins,"The ""super-smart"" bins have sensor technology fitted which trigger a compactor to crush the litter.",Coventry & Warwickshire,https://ichef.bbci.co.uk/news/480/cpsprodpb/7f3e/live/444349b0-58da-11ef-82be-7190598cb7eb.jpg.webp,https://www.bbc.com/news/articles/c89w7pxx8n7o
52,9 hrs ago,'A tech firm stole our voices - then cloned and sold them',A voice over artist found out his voice had been taken when he heard a chatbot on a podcast using it.,Climate solutions,https://ichef.bbci.co.uk/news/480/cpsprodpb/0d4f/live/01c1ad40-66f7-11ef-b43e-6916dcba5cbf.jpg.webp,https://www.bbc.com/news/articles/c3d9zv50955o
53,3 days ago,Are AI-created recipes hard to swallow?,"Chefs are increasingly using AI to dream up new food combinations, but the results are mixed.",Innovation,https://ichef.bbci.co.uk/news/480/cpsprodpb/3548/live/3bf08f00-50ad-11ef-9462-ef4aa241f684.jpg.webp,https://www.bbc.com/news/articles/cl7y71krnjvo
54,4 days ago,Telegram repeatedly refuses to join child protection schemes,BBC learns platform does not comply with industry norms as its boss remains under arrest in Paris.,Business,https://ichef.bbci.co.uk/news/480/cpsprodpb/e7de/live/6b2ce2b0-651f-11ef-8c32-f3c2bc7494c6.png.webp,https://www.bbc.com/news/articles/cy54905nv0go
55,18 Aug 2024,Calls to donate digital devices to people in need,Sunderland City Council says donations will go to local people without access to a digital device.,Wales,https://ichef.bbci.co.uk/news/480/cpsprodpb/1e84/live/3f320670-5bc6-11ef-b073-d3921346410f.png.webp,https://www.bbc.com/news/articles/cgl2x6e8jj8o
56,5 days ago,Have Swiss scientists made a chocolate breakthrough?,"The whole of the cocoa fruit is used in production, rather than just the beans.",Business,https://ichef.bbci.co.uk/news/480/cpsprodpb/0fa0/live/d71016c0-5582-11ef-aebc-6de4d31bf5cd.jpg.webp,https://www.bbc.com/news/articles/cn47zg3xgxxo
57,8 Aug 2024,Green light for £30m automation training centre,The new facility will teach businesses how they can harness automation technology.,Technology,https://ichef.bbci.co.uk/news/480/cpsprodpb/1419/live/30fcea70-5554-11ef-b2d2-cdb23d5d7c5b.png.webp,https://www.bbc.com/news/articles/cp8nlr94m50o
58,20 Aug 2024,Why there's anger at Alien: Romulus's shock cameo,The new Alien film has enraged many with the re-appearance of an actor from the 1979 original – brought back from the dead using digital trickery. Is such anger justified?,Leicester,https://ichef.bbci.co.uk/images/ic/480x270/p0jkk0b2.jpg.webp,https://www.bbc.com/culture/article/20240820-why-people-are-upset-about-the-surprise-cameo-in-alien-romulus
59,14 Aug 2024,Cancer patients to join personalised vaccine trial,"Eligible people will be referred to a special programme, Leeds Teaching Hospitals NHS Trust says.",Tyne,https://ichef.bbci.co.uk/news/480/cpsprodpb/28e3/live/62287d60-5993-11ef-898d-bb75fc70264d.jpg.webp,https://www.bbc.com/news/articles/c5yk7m9x8nmo
60,8 days ago,University aims to make immersive art more accessible,The project will see artists and participants with learning disabilities collaborate.,Leicester,https://ichef.bbci.co.uk/news/480/cpsprodpb/8fc0/live/2a9fe850-623b-11ef-b967-c793febfe478.jpg.webp,https://www.bbc.com/news/articles/cvg57nvelqlo
61,18 Aug 2024,The scientists drilling into an active Icelandic volcano,Scientists are preparing to drill into the rock of an Icelandic volcano to learn more about how volcanoes behave.,Technology,https://ichef.bbci.co.uk/images/ic/480x270/p0jhk026.jpg.webp,https://www.bbc.com/reel/video/p0jgsff2/the-scientists-drilling-into-an-active-icelandic-volcano
62,24 Aug 2024,The space hopper robot that 'walks' like a cat,Spencer Kelly checks out the latest robots being designed to help on space missions.,Tyne,https://ichef.bbci.co.uk/images/ic/480x270/p0jh61mt.jpg.webp,https://www.bbc.com/reel/video/p0jh60nw/the-space-hopper-robot-that-walks-like-a-cat
63,22 Aug 2024,Plan to hike windfall tax sparks energy jobs warning,Firms across the supply chain to the oil and gas industry have warned that official plans threaten investment.,Africa,https://ichef.bbci.co.uk/news/480/cpsprodpb/ae25/live/a29a2770-6070-11ef-b43e-6916dcba5cbf.jpg.webp,https://www.bbc.com/news/articles/cje2ynege5zo
64,14 Aug 2024,Thief caught stealing from a playgroup on CCTV,A thief broke into a playgroup and stole tablets used to teach toddlers how to use computers.,Lancashire,https://ichef.bbci.co.uk/news/480/cpsprodpb/6e32/live/ce3eac60-5a1d-11ef-997c-711b7066309d.jpg.webp,https://www.bbc.com/news/articles/cged7l78z4jo
65,13 Aug 2024,Post Office IT boss quits amid Horizon delays,Post Office tech chief Chris Brocklesby leaves after a year as Horizon IT replacement faces delays.,Cornwall,https://ichef.bbci.co.uk/news/480/cpsprodpb/3d4c/live/689b8830-5994-11ef-8f0f-0577398c3339.jpg.webp,https://www.bbc.com/news/articles/c80e5z2014do
66,1 day ago,Telegram: 'The dark web in your pocket',The arrest of Telegram’s chief executive in France has ignited a debate about moderation on his app.,Cornwall,https://ichef.bbci.co.uk/news/480/cpsprodpb/37ce/live/ef0b14c0-66fb-11ef-b970-9f202720b57a.jpg.webp,https://www.bbc.com/news/articles/cdey4prn3e1o
67,2 days ago,Will sustainable aviation fuels take off?,"Sustainable aviation fuels work, but can they be made in sufficient quantity to replace fossil fuels?",Sport,https://ichef.bbci.co.uk/news/480/cpsprodpb/28bd/live/03dd76e0-667f-11ef-ab63-7f50bd2acf17.png.webp,https://www.bbc.com/news/articles/cg64pwxzln4o
68,4 days ago,Trader 'first' in UK charged with operating crypto ATM,Habibur Rahman was charged after police said they seized crypto ATMs from a shop in Chatham.,Future,https://ichef.bbci.co.uk/news/480/cpsprodpb/7116/live/60dd6460-6547-11ef-93da-6573b106c366.jpg.webp,https://www.bbc.com/news/articles/cn4922d083no
69,10 Aug 2024,Maze designed to celebrate Katarina Johnson-Thompson,The maze is designed in the shape of the javelin thrower using GPS satellite technology.,Sport,https://ichef.bbci.co.uk/news/480/cpsprodpb/3650/live/069716c0-5667-11ef-983f-554187b31a7f.png.webp,https://www.bbc.com/news/articles/cpw8r1wye2qo
70,15 Aug 2024,No laughing matter - how AI is helping comedians write jokes,Some comedians are turning to artificial intelligence for their new new material.,Hampshire & Isle of Wight,https://ichef.bbci.co.uk/news/480/cpsprodpb/5716/live/0e512e30-54c0-11ef-a3c5-a912b356e1cf.jpg.webp,https://www.bbc.com/news/articles/c1jll2k0gewo
71,21 Aug 2024,Research finds drones can deliver blood safely,A project finds drone delivery does not influence the blood's quality or how long it lasts.,England,https://ichef.bbci.co.uk/news/480/cpsprodpb/2be4/live/072e9650-5f2f-11ef-8a20-fbba78365962.jpg.webp,https://www.bbc.com/news/articles/cx2e9l07w31o
72,10 Aug 2024,Maze designed to celebrate Katarina Johnson-Thompson,The maze is designed in the shape of the javelin thrower using GPS satellite technology.,Business,https://ichef.bbci.co.uk/news/480/cpsprodpb/3650/live/069716c0-5667-11ef-983f-554187b31a7f.png.webp,https://www.bbc.com/news/articles/cpw8r1wye2qo
73,13 Aug 2024,Why is Elon Musk's X struggling with technical problems?,The billionaire's interview with Donald Trump was delayed while the platform struggled with tech issues.,Asia,https://ichef.bbci.co.uk/news/480/cpsprodpb/3bf1/live/e7fdd960-599f-11ef-aebc-6de4d31bf5cd.jpg.webp,https://www.bbc.com/news/articles/cy0np2y5197o
74,15 Aug 2024,No laughing matter - how AI is helping comedians write jokes,Some comedians are turning to artificial intelligence for their new new material.,Wales,https://ichef.bbci.co.uk/news/480/cpsprodpb/5716/live/0e512e30-54c0-11ef-a3c5-a912b356e1cf.jpg.webp,https://www.bbc.com/news/articles/c1jll2k0gewo
75,21 Aug 2024,Research finds drones can deliver blood safely,A project finds drone delivery does not influence the blood's quality or how long it lasts.,Technology,https://ichef.bbci.co.uk/news/480/cpsprodpb/2be4/live/072e9650-5f2f-11ef-8a20-fbba78365962.jpg.webp,https://www.bbc.com/news/articles/cx2e9l07w31o
76,19 Aug 2024,Libya central bank reopens after kidnapped official freed,"CBL's governor speaks of ""increasing threats"" to the bank's safety after its IT boss was abducted.",Wales,https://ichef.bbci.co.uk/news/480/cpsprodpb/d132/live/05259d50-5d76-11ef-b43e-6916dcba5cbf.jpg.webp,https://www.bbc.com/news/articles/c8er628kx63o
77,22 Aug 2024,Digital memory boxes introduced for children in care,The digital tool is being used to help young people in care in Blackpool keep hold of memories.,Worklife,https://ichef.bbci.co.uk/news/480/cpsprodpb/bec2/live/602189b0-5ffd-11ef-b910-d9e853c76653.jpg.webp,https://www.bbc.com/news/articles/c8dpejg2pl2o
78,6 days ago,College offers workshops to boost career prospects,The initiative aims to support adults in their career or achieve skills for new opportunities.,Asia,https://ichef.bbci.co.uk/news/480/cpsprodpb/fb31/live/7be71f50-5fd2-11ef-b07e-6f457908c890.png.webp,https://www.bbc.com/news/articles/cy0rqp8qd4lo
79,16 Aug 2024,Concerns over digital landline switch in Boscastle,"Twenty years after devastating floods, villagers fear being cut off in any future emergencies.","NE, Orkney & Shetland",https://ichef.bbci.co.uk/news/480/cpsprodpb/e30c/live/c949c930-5a34-11ef-a88c-9f995a4e445d.jpg.webp,https://www.bbc.com/news/articles/c78l90pjrg3o
80,13 Aug 2024,The unique wearable tech revolutionising wheelchair racing,A high-tech sleeve uses biometric threads to collect athletes' data to enhance their performance.,Lincolnshire,https://ichef.bbci.co.uk/images/ic/480x270/p0jj1w6n.jpg.webp,https://www.bbc.com/reel/video/p0jj14y4/the-unique-wearable-tech-revolutionising-wheelchair-racing
