Unnamed: 0,time_ago,titles,subtitles,location,images,Links,Article_Content
29,5 days ago,Zuckerberg regrets bowing to Biden 'pressure' over Covid,The billionaire says White House officials pressured Meta to remove content 'for months' in 2021.,US & Canada,https://ichef.bbci.co.uk/news/480/cpsprodpb/e1db/live/659aed50-6453-11ef-91f3-273f9f80a920.jpg.webp,https://www.bbc.com/news/articles/czxlpjlgdzjo,"Meta boss Mark Zuckerberg says he regrets bowing to what he calls pressure from the Biden administration to ""censor"" content on Facebook and Instagram during the coronavirus pandemic.In a letter sent to a US House committee chair, he said some material – including humour and satire – was taken down in 2021 under pressure from senior officials.The White House has defended its actions, saying it encouraged ""responsible actions to protect public health and safety"".Mr Zuckerberg also said his firm briefly ""demoted"" content relating to Joe Biden's son, Hunter, ahead of the 2020 election, after the FBI warned of ""a potential Russian disinformation"" operation. It later became clear that this content was not part of such an operation, Mr Zuckerberg said, and it should not have been temporarily taken down.Mr Zuckerberg did not give further detail about the actions he regretted during the pandemic. At that time, his business removed posts for a variety of reasons.Mr Zuckerberg said the decisions made were the decisions of his business, but that the “government pressure was wrong”.He continued: ""We made some choices that, with the benefit of hindsight and new information, we wouldn't make today.""Mr Zuckerberg said he and Meta would be ready to ""push back"" if something similar happened in the future.His letter was addressed to Jim Jordan, the chair of the House judiciary committee, which has been investigating content moderation on online platforms. Republicans said the letter was a ""big win for free speech"".In a statement issued to the website Politico, the White House stood by its actions.It said: “Our position has been clear and consistent: we believe tech companies and other private actors should take into account the effects their actions have on the American people, while making independent choices about the information they present.”Mr Zuckerberg's comments on Hunter Biden refer to the story of a laptop that was abandoned by the president's son at a repair shop in Delaware - as first reported by the New York Post.The newspaper claimed emails found on the computer suggested his business abroad had influenced US foreign policy while his father was vice-president.The president and his family have denied any wrongdoing.The story became a notable right-wing talking point in the US, and a point of contention as some social media platforms censored the content.Mr Zuckerberg said the story was temporarily demoted on his platforms while going through a fact-check - after a warning from the FBI of a potential Russian disinformation operation, and ""in retrospect, we shouldn't have demoted the story,"" Mr Zuckerberg wrote.""We've changed our policies and processes to make sure this doesn't happen again.""Mr Zuckerberg also said he did not plan to make any more contributions to supporting electoral infrastructure.In 2020, he donated $400m (£302m) via his philanthropic Chan Zuckerberg Initiative which was intended to help government offices conduct the election during the pandemic.However, misinformation spread rapidly on social media accusing Mr Zuckerberg of effectively using a loophole to skirt maximum donation limits in a bid to get Mr Biden elected.Mr Zuckerberg said his donations ""were designed to be non-partisan"".""Still, despite the analyses I've seen showing otherwise, I know that some people believe this work benefited one party over the other.""My goal is to be neutral and not play a role on way or another - or to even appear to be playing a role - so I don't plan on making a similar contribution this cycle."""
30,4 days ago,Can Barbie help beat teen smartphone addiction?,Manufacturer HMD says it is trying to help people who want less 'digital impact' in their lives.,Asia,https://ichef.bbci.co.uk/news/480/cpsprodpb/901f/live/87ba6300-6482-11ef-827b-e3db9c05b116.png.webp,https://www.bbc.com/news/articles/cx2x52y0wv4o,"A Barbie-branded phone has been launched in the UK and Europe with the aim – its makers say – of helping young people take a break from their smartphones.It is a very pink and fundamentally very basic device, with no front camera, only one game and very limited access to the internet.Manufacturer HMD, which also makes phones for Nokia, says it's trying to tap into what it calls a ""surge"" of people wanting a smaller ""digital impact"" on their lives.But others say that would be better achieved by teaching people how to use their devices in a healthier and more controlled way.There are growing calls from parents and campaigners to limit the time children spend on smartphones, or even ban the devices completely.Their concerns range from the suspicion children will end up with shorter attention spans, to the fear that they might be exposed to harmful or illegal content.Some schools are taking action, perhaps most eye-catchingly the UK's best known fee-paying school, Eton College. It is providing some of its pupils with ""brick"" phones – also sometimes called feature phones – which can only send and receive texts and calls.It says it wants to ""balance the benefits and challenges that technology brings to schools.""And this week mobile network EE waded into the debate by advising parents not to allow their under-11s smartphones at all.Lars Silberbauer, a senior executive at HMD, says it is these trends his firm is responding to.""We've seen this surge which started in the US coming to Europe, that more and more people actually want to not be having a digital experience all the time,"" he said.Some may be sceptical about how truly noble Mr Silberbauer's motives are – and he did concede he would “love” to be able to incorporate a messaging platform like WhatsApp into the Barbie phone. But I spent a day using it and, for now, there is little doubt that as a digital detox it was certainly effective because of its very limited functionality.It is mirror-fronted flip phone and has no app store or touch screen. I had no social media at all, and the phone can not receive anything more advanced than SMS messages.That means no text messages with ""read receipts"" or the function to see when someone is typing. It is the default setting on many smartphones – so I didn’t get many text messages either.Even with predictive text enabled I found the numbers and letters keypad much slower than a touchscreen keyboard and as a result I ended up calling more people than usual, which perhaps was no bad thing. And I discovered there are only so many times you can play the retro Nokia game Snake, even when it’s called Malibu Snake and it's pink. But the handset certainly attracted a lot of attention, especially from girls and young women, as I walked around Glasgow city centre with it.There is of course the danger that instead of being pestered for a smartphone, parents will find themselves being pestered for a piece of Barbie merchandise - which may be just as unwelcome.The phone has a launch price of £99 in the UK – twice what you would pay for a non-branded Nokia feature phone. There are plenty of other phones on the market that offer the same limited functionality, but without any kind of big corporate tie in.""I’d imagine quite a few people will be tempted to buy it as a bit of fun, but in reality, everyone is so dependent on their smartphones that anything more than the odd day of detox will be a stretch,"" says Ben Wood, a phone expert who has his own museum of devices released over the years.Nonetheless, he says, there is a market for what are sometimes called ""dumbphones"". His firm, CCS Insight, estimates that around 400,000 will be sold in the UK this year.""That's an attractive niche for a company like HMD"", he says.Some experts suggest that withdrawing smartphones is no real solution – they are woven into our lives, after all – and instead children need to be taught how to use them in a healthy and safe way. ""What we should be doing instead is thinking about, how do we build really good, really long term, sustainable digital literacy skills in that generation,"" says Pete Etchells, professor of psychology and science communication at Bath Spa university, who has written extensively about the issue of screen time.“I think we could all be better at using our phones in a healthier and more resilient way,"" he said.HMD is also working on a separate project, a new device which it is designing in collaboration with parents. It says more than 1,000 people have signed up to work on it so far.And Mr Silberbaum concedes that the resulting handset may well end up being something that sits somewhere between a dumbphone and a smartphone.“Do I want the smartphone with all the bells and whistles, or do I want to have something that can actually help me have a more considered approach to digital? That's the choice we want to deliver,” he said."
31,4 days ago,Klarna: AI lets us cut thousands of jobs - but pay more,"The firm wants to reduce staff levels to 2,000 works through its use of AI in marketing and customer service.",Technology,https://ichef.bbci.co.uk/news/480/cpsprodpb/c63a/live/fd13e7f0-651a-11ef-be1a-47dbeb9bfccf.jpg.webp,https://www.bbc.com/news/articles/c80e1gp9m9zo,"The buy now, pay later firm Klarna is seeking to get rid of almost half its employees in the coming years through efficiencies it says arise out of its investment in artificial intelligence (AI).The firm has already cut its workforce from 5,000 to 3,800 in the past year, and wants to reduce that to 2,000 employees by using AI in marketing and customer service.Boss Sebastian Siemiatkowski told the BBC the job cuts would mean Klarna could pay its remaining workers more.But he said the government needed to think about what to do about AI, which he predicted would have ""a dramatic impact"" on jobs and society.""I think politicians already today should consider whether there are other alternatives of how they could support people that may be effective,"" he told the Today programme, on BBC Radio 4.He said it was ""too simplistic"" to simply say new jobs would be created in the future.""I mean, maybe you can become an influencer, but it's hard to do so if you are 55-years-old,"" he said.The recent proliferation of AI has put its benefits and risks under the spotlight.Earlier this year, the International Monetary Fund (IMF) said it believed AI would impact nearly 40% of all jobs, and it would ""likely worsen overall inequality"".In other sectors, such as the games industry, developers have warned they are already losing work to AI.Klarna - which is based in Sweden, and has two UK offices - disclosed its job-cutting plans as it announced interim results which showed it increased its revenue by 27% to 13.3 billion Swedish krona (£990 million).""Our proven scale efficiencies have been enhanced by our investment in AI, which has driven down operating expenses and improved gross profits,"" it said.It comes as unions have warned of mass job losses amid the growth of AI and are calling for legislation to protect workers.Mr Siemiatkowski  said Klarna would reduce its headcount through what he called ""natural attrition"" - effectively a hiring freeze, where staff aren't replaced after they leave.Typically this means the people that remain are left with an increased workload.But Mr Siemiatkowski contended that AI would be replacing this work, and even claimed it was a potential ""positive development"" for some individuals who may be paid more.While he said it was ""critical"" for government to consider what to do about those who lost their jobs, he suggested there was no ""stopping progress"" for firms like his.""It's important that Europe and democracies are ahead in the evolution of AI,"" he said.Klarna is understood to be shrinking its workforce ahead of a listing on the stock exchange, which has recently been dominated by firms heavily investing in AI, such as Nvidia and Microsoft.This means Klarna being seen as a big proponent of the tech may make its stock more appealing to investors when it does eventually go public."
32,21-Aug-24,London through the ages inspires Civilization VII,An eight-year wait for news on the next Civilization game is finally over.,Technology,https://ichef.bbci.co.uk/news/480/cpsprodpb/8f10/live/5e9f7a30-5fd4-11ef-b970-9f202720b57a.jpg.webp,https://www.bbc.com/news/articles/c8dp64e0r85o,"Fans of Civilization have been waiting almost a decade for the latest instalment of the cult video game series. Now it has been revealed that theme of time passing is pretty appropriate: the inspiration at the heart of Civilization VII, to be released in February, is how the capital of the UK has changed from the Roman era to now.And it all started with a map of Londinium - as London was known to the Romans.""Londinium looked like pretty much any frontier Roman town with an amphitheatre, baths, and a shaky bridge that crossed to the south side of the Thames,"" observed the game's lead developer Ed Beach, as he showed me the below map - used here courtesy of Encyclopaedia Britannica.""But I wanted to look at how this evolved, and how this changed as London grew and prospered."" It is the lessons from those changes that will lie at the heart of the new game.The Civilization series has sold 70 million copies since it began in 1991 - with the last edition released in 2016.The question of what direction developers Firaxis would take the next version of the game in has been a hot topic among fans.I include myself in that group - my brother first introduced me to Civ II on our PlayStation back in the 90s, and I was recently slightly horrified to discover I've spent more than 500 hours playing the sixth iteration of the series.For those that don't know, Civilization is at times more like a board game than a video game. You move units around a map, placing down cities and developing them, while fighting others to conquer their land for your own.Previous games in the series have locked players into playing as a particular leader and civilisation combination, such as Teddy Roosevelt and the United States, or Cleopatra and Egypt.But the developers say this isn't truly representative of how cities developed, where multiple different ruling groups leave their mark - just as they have with London.In the new game, a player might start off as the Romans, building their own Londinium in what it calls the antiquity era. But after progressing to the next stage - the exploration era in the game's lingo - players might become the Normans and build over what came before.The game's developers drew inspiration from Ludgate, the site of the west gate in the former London Wall, and dug up more old maps to see how the area had changed 1,000 years after the Romans left London.""London changes, and it grows, but you can see that core Roman encampment,"" Mr Beach said.The map, produced by Layers of London, part of the UK's Institute of Historical Research, shows the River Fleet still flows - but much of the Roman era buildings are no longer there.""It's all been built over by the buildings that you would expect in a medieval or renaissance era city,"" Mr Beach said.""We have inns, we have taverns, we still have religious buildings to the east side of the wall, but it's now St Paul's Cathedral, the very first version of it, before it got burned in the Fire of London. ""And we see that the river has been rerouted a little bit so that they can have a prison to hold some of those miscreants from the Middle Ages and keep them at bay.""This difference formed the foundation of the new game - building on top of what came before, to craft distinctly different eras.Finally, the developers jumped forward in time to the Victorian era, to see how the Ludgate area had changed once more.This map, reproduced with the permission of the National Library of Scotland, shows another significant set of changes - with the River Fleet now no longer visible after it was rerouted underground to be used for sewage in the mid-1800s.""Now the prison is totally replaced, the needs of the industrial revolution dictate we need a rail line in there, and Ludgate rail station is exactly on top of where the prison used to be,"" Mr Beach said.""All those buildings that used to support religious activity have pretty much been overtaken, except for St Paul's Cathedral.""This third stage of change - which the new game calls the modern era - solidified the concept for the developers.In London's example, gamers could play as the Romans, then the Normans, then as Britain - all the while building a growing England that goes beyond just the capital city.But while the big shift in style may be exciting for some, hardcore fans of the series might be concerned about just how different it is.It comes amid many other changes which will be meaningful to fans - though they won't make too much sense to people who haven't played the game.The game's developers tell me civilisations controlled by the computer will behave more intelligently. They list the seemingly endless changes like checking off a list - each civilisation has its own unique set of civics it can discover, units can now travel through rivers, and there are no more builders.There are expected changes - like a graphical overhaul that makes the game look modern - and unexpected ones too - like shifting the leaders you play as to include important historical figures that didn't lead their country, like Benjamin Franklin and Confucius.Meanwhile Hatshepsut, one of Egypt's historical female leaders, is now playable. The game's narrator - Game of Thrones and Star Wars actress Gwendoline Christie - adds a layer of gravitas to the visual upgrade.But not everything was directly taken from a fan's wishlist.Roads will still be built automatically by traders, which has long been a sore point for some players. There are some changes to the game's take on religion, but it still sounds to me like players will be micro-managing missionaries around the map.And big promises of fixing the AI are well-received, but without seeing the final product it's hard to be convinced.Moving between ages seems to be linked to crises - like barbarian invasions, civil wars and plagues - though exactly how this will work is unclear.Mr Beach said it develops a ""cool cycle that you go through three times in the game that we're releasing here at launch"" - a sentence I told him sounded suspiciously like Firaxis might be considering adding further cycles and empires in the future.He wouldn't be drawn on it.But one thing that seems certain is that by having what is effectively a big reset button between eras, no one player can storm ahead and take an unassailable lead at the start of each game, which will be music to fans' ears.We'll find out when the game comes next year."
33,21-Aug-24,ChatGPT firm OpenAI strikes deal with Vogue owner,The multi-year deal is the latest such agreement to be struck between OpenAI and a major media company.,Surrey,https://ichef.bbci.co.uk/news/480/cpsprodpb/62af/live/78563b60-5f59-11ef-b96a-9d9c7f5b25ee.jpg.webp,https://www.bbc.com/news/articles/cpqjvl9z9w1o,"OpenAI and global magazine giant Condé Nast have announced a partnership to allow ChatGPT and its search engine SearchGPT to display content from Vogue, The New Yorker, GQ and other well known publications.The multi-year deal is the latest such agreement struck by OpenAI with major media firms.The content produced by media organisations is sought after by technology companies that use it to train their AI (Artificial Intelligence) models.Some media firms including the New York Times and the Chicago Tribune have resisted this and taken legal action to protect their content.OpenAI and Condé Nast did not disclose the financial terms of the agreement.“We’re committed to working with Condé Nast and other news publishers to ensure that as AI plays a larger role in news discovery and delivery, it maintains accuracy, integrity, and respect for quality reporting,” said Brad Lightcap, OpenAI's chief operating officer.News media organisations have seen their business models challenged by the rise of social media and other digital platforms.""Our partnership with OpenAI begins to make up for some of that revenue, allowing us to continue to protect and invest in our journalism and creative endeavours,"" said Condé Nast's chief executive officer Roger Lynch.OpenAI launched its prototype AI-powered search engine, SearchGPT, last month. In a statement at the time, the company said it was gathering feedback and insights from its partners in the news industry to develop the new platform.Others that have partnered with the AI firm include Time Magazine, the Financial Times and the Associated Press.AI chatbot technology is seen by many analysts as a key part of internet search engines in the future.Search engine giant Google has also been racing to add AI-powered tools to its products.While other AI companies are pursuing search products, Google remains by far the dominant player, claiming more than 90% of the global market.The changes to how search engines respond to queries - offering conversational paragraphs instead of directing users to links - have also raised alarm among news media firms, many of which rely on search traffic for audiences and revenue.Last year, the BBC said it was taking steps to prevent content on its websites from being used by OpenAI and other firms without permission.The blog post also said the BBC would explore opportunities offered by generative AI ""to deliver more value to our audiences and to society."""
34,22-Aug-24,Top US college says diversity slumps after affirmative action ban,MIT says intake of some minority groups has fallen from 25% to 16% in one year after a Supreme Court decision.,Technology,https://ichef.bbci.co.uk/news/480/cpsprodpb/c593/live/d29fa110-6166-11ef-b4f3-d9f05349be86.jpg.webp,https://www.bbc.com/news/articles/c8rxvd2z6ldo,"A prestigious US university has recorded a sharp fall in admissions from ""members of historically under-represented racial and ethnic groups,” following a Supreme Court decision to end affirmative action.The Massachusetts Institute of Technology (MIT) said 16% of its new intake identify as being black, Hispanic, Native American and/or Pacific islander - down 10 percentage points in one year. The Supreme Court ruled in 2023 that university admissions schemes promoting diversity violated the US Constitution's equal protection clause.Stu Schmill, MIT's dean of admissions, said he expected a fall and ""that is what happened"". He said he had ""no doubt that we left out many well-qualified, well-matched applicants... who would have excelled"".MIT is the first major university to publish data on intake since the court ruling.Sally Kornbluth, the president of MIT, said in an announcement that the new student intake was ""as always, outstanding"".""What it does not bring, as a consequence of last year's Supreme Court decision,"" she added, ""is the same degree of broad racial and ethnic diversity that the MIT community has worked together to achieve over the past several decades.""In recent years, around 25% of MIT's enrolling undergraduate students have identified as Black, Hispanic, and/or Native American and Pacific Islander, Mr Schmill added.Its figures show that this year, the percentage of black students enrolled dropped to 5% from 15%, and the percentage of Hispanic and Latino students dropped to 11% from 16%. White students make up 37% of the new class, compared with 38% last year, while the percentage of Asian American students rose to 47% from 40%. Asian-Americans are not included in MIT’s category of students “historically under-represented” in STEM (science, technology, engineering and mathematics) subjects, which Mr Schmill has previously acknowledged to be a “crude standard”.The new admissions figures do not total 100% as some students identify as more than one race or ethnicity.More than 40% of the US population identifies as a race other than white, according to 2023 census data.In his latest comments, Mr Schmill said the intake in the year before the court decision had the largest proportion of under-represented minority students in the university's history. He added that MIT did not solicit race or ethnicity information from applicants this year, only from those who were enrolled.The university said the court decision had prompted it to expand recruitment and financial aid initiatives that prioritise low-income students from all backgrounds.Mr Schmill added that the university now looks for diversity through ""prospective fields of study and areas of research, extracurricular activities and accomplishments, as well as economic, geographic, and educational background"".Edward Blum, whose Students for Fair Admissions group brought the Supreme Court case, told The New York Times that ""every student admitted... will know that they were accepted only based upon their outstanding academic and extracurricular achievements, not the colour of their skin""."
