Unnamed: 0,time_ago,titles,subtitles,location,images,Links,Article_Content
35,23-Aug-24,When vets are scarce what can farmers do?,In Vietnam farmers are being encouraged to track the use of antibiotics and monitor disease.,Wales,https://ichef.bbci.co.uk/news/480/cpsprodpb/1cfc/live/5984cae0-44e1-11ef-96a8-e710c6bfc866.jpg.webp,https://www.bbc.com/news/articles/ce58nvdg327o,"Quang Doan Hong is a busy person. The accountant, who lives with his family in Hưng Yên, Vietnam, also owns a farm with about 600 pigs.He’s had to learn quickly about pig health, from which vaccines are effective to when to use antibiotics.“When the weather changes, I give the pigs antibiotics,” Mr Hong says. In his experience, rapid changes between sunny and rainy weather make it necessary to administer antibiotics for respiratory and diarrhoeal diseases.Mr Hong has also had to learn which sources of information are reliable. He’s joined farming groups and done online research, although he’s realised that some information on Facebook, for instance, isn’t reliable. “I need to filter it,” he explains.As his operation has grown, Mr Hong has become reluctant to have veterinarians visit.He worries about the risk of disease transmission from people who come into contact with animals at many different sites. Some large farms require animal health workers to quarantine for several days before visiting.One thing that would be useful to Mr Hong is a hybrid source of information: something that combines the expertise of veterinarians with the convenience of digital access.These kinds of remote veterinary technologies are under development.The team behind Farm2Vet, a veterinary app for farmers, recently won the top prize from the Trinity Challenge, a charity tackling global health threats.The competition that Farm2Vet won focused on antimicrobial resistance (AMR) – the urgent global threat of our limited slate of antibiotic medicines becoming less effective as pathogens adapt.Farms where antibiotics are overused can become breeding grounds for antibiotic-resistant bacteria. These bacteria then enter the food system and the environment, for instance due to animal waste. Some drug-resistant bacteria, like certain strains of E. coli, can spread between animals and humans.“Antibiotic misuse and overuse largely relates to a lack of understanding, a lack of support,” says Marc Mendelson, the director of the Trinity Challenge, who also heads the infectious diseases division at the University of Cape Town’s hospital.Veterinary antibiotics can be extremely cheap, Prof Mendelson says. “Some farmers probably don’t even know that they’re giving antibiotics, because it’s just in the feed.”Vietnamese regulations now require prescriptions for livestock antibiotics. But this requirement is relatively recent and difficult to monitor. In practice, antibiotics are dispensed without prescriptions, Pawin Padungtod acknowledges.Dr Padungtod, based in Hanoi, is the senior technical coordinator for the Emergency Centre for Transboundary Animal Diseases (ECTAD), a unit of the Food and Agriculture Organization (FAO).Helen Nguyen grew up in Vietnam and now lives in US, where she is an environmental engineer at the University of Illinois Urbana-Champaign. Both countries have issues with the way antibiotics are given to farm animals, she says.In the US, medically important antibiotics are used for livestock far more often than they’re used for human beings. And in Vietnam, Prof Nguyen says, only larger farmers can afford or access veterinarians.Prof Nguyen and the rest of the Farm2Vet team are seeking to address these issues in Vietnam by working with farmers, veterinarians, and agricultural suppliers to develop a smartphone app that provides reliable information on animal care.There would be an AI-powered chatbot to answer relatively simple questions, and connections to veterinarians in more complex cases.“The technology that we are trying to produce doesn’t replace vets,” according to Prof Nguyen. The aim is to allow veterinarians to expand their reach.She says that the challenge is not developing the technology, but accumulating the knowledge base.While there are Vietnamese-language veterinary publications, the amount of data required to feed the AI is likely to exceed what’s available in Vietnamese. Because so much of the published veterinary science is in English, it’s important to carefully translate and localise the information, even to the provincial level.It will be years before the app is ready. Prof Nguyen says that while the app will be free for farmers to use, eventually, for financial sustainability, the aim is to allow advertising and a paid farming certification programme.Also in Vietnam, the International Livestock Research Institute is designing a similarly named app, FarmVetCare. The idea is that using the app, farmers will report health abnormalities in livestock to a veterinarian. This is intended to help prevent and control animal diseases and diseases which can transfer between animals and humans.A different app is being piloted to extend the reach of the digital system for logging animal disease outbreaks through Vietnam’s Department of Animal Health. While the system now allows daily online reporting at the provincial level, the aim is to localise the reporting further, to be as close to the farm as possible.“The mobile application will then be very helpful because now they can start the reporting closer to the site of where the outbreak is,” Dr Padungtod says.Farmers may be reluctant to report veterinary diseases “because they don’t want to go bankrupt”, Prof Nguyen says. The Farm2Vet app would allow farmers to report veterinary illnesses anonymously, and the team would not provide identifiable data to anyone, according to Prof Nguyen.Prof Mendelson reckons such tools that can simplify the process of reporting, especially for subsistence farmers, are helpful.They may also help to prevent infection in the first place, which would cut down on the need for precious antibiotics. “The biggest bang for buck is in preventing infection – and not only in humans, but in in livestock,” Prof Mendelson says.He comments that governments could encourage prevention by making vaccination more accessible. And farmers could reduce the chances of infection by giving farm animals more space. Prof Mendelson says, “Intensive livestock farming increases stress on animals. It increases illness and risks.”While the tech world is full of well-meaning apps that end up being little used, Mr Hong, the pig farmer, has expressed interest. He appreciates the practicality and user-friendliness of apps. “If available, I would like to use them,” he says."
36,4 days ago,Can Barbie help beat teen smartphone addiction?,Manufacturer HMD says it is trying to help people who want less 'digital impact' in their lives.,Technology,https://ichef.bbci.co.uk/news/480/cpsprodpb/901f/live/87ba6300-6482-11ef-827b-e3db9c05b116.png.webp,https://www.bbc.com/news/articles/cx2x52y0wv4o,"A Barbie-branded phone has been launched in the UK and Europe with the aim – its makers say – of helping young people take a break from their smartphones.It is a very pink and fundamentally very basic device, with no front camera, only one game and very limited access to the internet.Manufacturer HMD, which also makes phones for Nokia, says it's trying to tap into what it calls a ""surge"" of people wanting a smaller ""digital impact"" on their lives.But others say that would be better achieved by teaching people how to use their devices in a healthier and more controlled way.There are growing calls from parents and campaigners to limit the time children spend on smartphones, or even ban the devices completely.Their concerns range from the suspicion children will end up with shorter attention spans, to the fear that they might be exposed to harmful or illegal content.Some schools are taking action, perhaps most eye-catchingly the UK's best known fee-paying school, Eton College. It is providing some of its pupils with ""brick"" phones – also sometimes called feature phones – which can only send and receive texts and calls.It says it wants to ""balance the benefits and challenges that technology brings to schools.""And this week mobile network EE waded into the debate by advising parents not to allow their under-11s smartphones at all.Lars Silberbauer, a senior executive at HMD, says it is these trends his firm is responding to.""We've seen this surge which started in the US coming to Europe, that more and more people actually want to not be having a digital experience all the time,"" he said.Some may be sceptical about how truly noble Mr Silberbauer's motives are – and he did concede he would “love” to be able to incorporate a messaging platform like WhatsApp into the Barbie phone. But I spent a day using it and, for now, there is little doubt that as a digital detox it was certainly effective because of its very limited functionality.It is mirror-fronted flip phone and has no app store or touch screen. I had no social media at all, and the phone can not receive anything more advanced than SMS messages.That means no text messages with ""read receipts"" or the function to see when someone is typing. It is the default setting on many smartphones – so I didn’t get many text messages either.Even with predictive text enabled I found the numbers and letters keypad much slower than a touchscreen keyboard and as a result I ended up calling more people than usual, which perhaps was no bad thing. And I discovered there are only so many times you can play the retro Nokia game Snake, even when it’s called Malibu Snake and it's pink. But the handset certainly attracted a lot of attention, especially from girls and young women, as I walked around Glasgow city centre with it.There is of course the danger that instead of being pestered for a smartphone, parents will find themselves being pestered for a piece of Barbie merchandise - which may be just as unwelcome.The phone has a launch price of £99 in the UK – twice what you would pay for a non-branded Nokia feature phone. There are plenty of other phones on the market that offer the same limited functionality, but without any kind of big corporate tie in.""I’d imagine quite a few people will be tempted to buy it as a bit of fun, but in reality, everyone is so dependent on their smartphones that anything more than the odd day of detox will be a stretch,"" says Ben Wood, a phone expert who has his own museum of devices released over the years.Nonetheless, he says, there is a market for what are sometimes called ""dumbphones"". His firm, CCS Insight, estimates that around 400,000 will be sold in the UK this year.""That's an attractive niche for a company like HMD"", he says.Some experts suggest that withdrawing smartphones is no real solution – they are woven into our lives, after all – and instead children need to be taught how to use them in a healthy and safe way. ""What we should be doing instead is thinking about, how do we build really good, really long term, sustainable digital literacy skills in that generation,"" says Pete Etchells, professor of psychology and science communication at Bath Spa university, who has written extensively about the issue of screen time.“I think we could all be better at using our phones in a healthier and more resilient way,"" he said.HMD is also working on a separate project, a new device which it is designing in collaboration with parents. It says more than 1,000 people have signed up to work on it so far.And Mr Silberbaum concedes that the resulting handset may well end up being something that sits somewhere between a dumbphone and a smartphone.“Do I want the smartphone with all the bells and whistles, or do I want to have something that can actually help me have a more considered approach to digital? That's the choice we want to deliver,” he said."
37,16-Aug-24,Fortnite app returns to iPhones - but only in the EU,The boss of the game's publisher says he hopes to bring it to UK iPhones in 2025.,Technology,https://ichef.bbci.co.uk/news/480/cpsprodpb/9844/live/9f697060-5bcf-11ef-99f7-3dae98c58eb1.jpg.webp,https://www.bbc.com/news/articles/c70j5rx72yvo,"Fortnite, one of the world's biggest video games, is available as an iPhone app for the first time in four years.However, it will only be available to players in the European Union.This is because EU law requires Apple to allow third-party app stores on its devices - other parts of the world do not have comparable legislation.The game was removed from the App Store in 2020 following a payments row between Apple and Epic.Users will have to install an alternative app store on to their phones in order to download the game.One of these alternative shopfronts is the newly-launched Epic Games Store, which is also available on Google Android devices for the first time.Epic admits the process is ""lengthy"" and blames Apple and Google for ""introducing intentionally poor-quality install experiences laden by multiple steps, confusing device settings, and scare screens.""Apple said in a statement that new EU law ""required us to enable new capabilities for developers in the EU, and we have worked to make them as easy as possible for users while also trying to protect their privacy and security.""The BBC has approached Google for comment.It comes as Fortnite launches its new season based around Marvel's Doctor Doom.New EU legislation, called the Digital Markets Act, came into force in March, which means that Apple has to allow alternative app stores on its devices. However, those laws do not exist in other parts of the world, where apps can only be downloaded from Apple's official App Store. ""Fortnite has been freed on iOS in Europe, thanks to the Digital Markets Act"", Epic boss Tim Sweeney said on X.""Apple continues to block Fortnite from a billion players in the rest of the world, and the battle rages on to restore free market competition.""Apple says this is mainly for security reasons.However, Epic argues that it means Apple has a monopoly and can charge high rates - up to 30% commission on purchases - to app developers.A similar commission is charged by Google when apps are downloaded through its Google Play store.However, Google does allow alternative app stores on its Android devices.Android users could already download the Fortnite app directly from Epic Games on to their phones.Fortnite is free to play, but makes money by charging players for in-game purchases for items such as new skins or weapons.It was removed from Apple and Google's app stores in 2020 after Epic Games stopped paying the commission.Currently, UK iPhone users cannot download Fortnite, however they can play on a browser.The Guardian reports Epic Games wants to bring the Fortnite app back to UK iPhones in late 2025.“Unless Apple and Google manage to lobby the UK government that they should be able to continue blocking competition, we should be able to move on that by the end of next year,” Tim Sweeney told them.New competition law was passed in May, which could pave the way for alternative app stores on iPhones.""The fight is far from over, but this is tangible progress for developers and consumers who can begin to benefit from competition and choice,” Mr Sweeney said in a press release.Epic Games has also made its games Rocket League Sideswipe and Fall Guys available on its new app store."
38,4 days ago,"Film studio launches £250,000 education fund",Shepperton Studios will support education in film and media for young people in Spelthorne.,Tennis,https://ichef.bbci.co.uk/news/480/cpsprodpb/8f82/live/8f99fb40-6535-11ef-afd2-8d79aeaa745d.jpg.webp,https://www.bbc.com/news/articles/cd6yw761pzdo,"A Surrey film studio has launched a £250,000 fund to support film and media teaching to young people.Shepperton Studios, part of the Pinewood Group, said it wants to raise awareness of the sector and routes in to the industry for the next generation of filmmakers.The ""Virtual Academy"" fund of up to £50,000 per year for five years aims to provide technology and equipment for educational facilities in the borough.Tristam Slater, general manager at Shepperton Studios, said: ""Grants will be awarded to projects benefitting the Shepperton area and the wider borough of Spelthorne.""Mr Slater added that the fund was a ""vital part"" of the Virtual Academy which includes a number of initiatives to support the ""filmmakers of the future"".He explained: ""Grants awarded will focus on supporting key areas of youth development across primary, secondary, and tertiary levels of education and actively seek to support under-represented and under-privileged groups who would otherwise have difficulty accessing funds.""Daniel Mouawad, chief executive of Spelthorne Borough Council, said: “This fund will have a real positive impact for younger residents in the borough.""Expressions of interest opened on Tuesday, and education establishments have until 09:00 BST on 14 October to submit.Follow BBC Surrey on Facebook, on X. Send your story ideas to southeasttoday@bbc.co.uk  or WhatsApp us on 08081 002250."
39,16-Aug-24,Testing out smart swim goggles for the Paris Games,A new generation of smart goggles provide real time visual feedback to enhance athletic performance.,Tennis,https://ichef.bbci.co.uk/images/ic/480x270/p0jjntzt.jpg.webp,https://www.bbc.com/reel/video/p0jjnj0l/testing-out-smart-swim-goggles-for-the-paris-games,"BBC technology reporter Paul Carter tries out the smart goggles used by Olympians and Paralympians in training for the Paris Games. The goggles come with sensors which collect all kinds of information, including new compass data, which is displayed directly onto the goggle lens."
40,14-Aug-24,Watch as thief burgles a playgroup,A thief broke in to a playgroup in Blackwood and stole about £500 worth of technology.,South Yorkshire,https://ichef.bbci.co.uk/news/480/cpsprodpb/83e1/live/9e7226c0-5a1c-11ef-8f0f-0577398c3339.jpg.webp,https://www.bbc.com/news/articles/c62rxjy2gn2o,"A thief was caught red-handed on CCTV breaking in to a playgroup and stealing computers on Monday. Helen Williams, the owner of Markham playgroup in Blackwood, Caerphilly, said she was ""destroyed"" that someone would take from toddlers. "
41,21-Aug-24,Venue trials app for partially sighted visitors,A series of QR codes can be scanned for more information on the property's gardens.,Business,https://ichef.bbci.co.uk/news/480/cpsprodpb/f001/live/538d5bf0-5efb-11ef-bfa4-71cd40e04d31.jpg.webp,https://www.bbc.com/news/articles/cvgx12wgjyxo,"Technology is being trialled to help partially sighted visitors get around a National Trust venue.QR codes from a navigation app have been put up around Saltram in Plymouth which people can scan to get information to guide them.The National Trust said the information, which is spoken out loud on visitor's phones, will provide navigational and other content relevant to Saltram's historic garden setting.It said the trial would run until 25 October.The National Trust said the codes have been placed along a pre-determined route in Saltram's gardens.The route received positive feedback when it was tested by the Royal National Institute of Blind People and a test group in May, the National Trust added.Natalie Haly, project manager for the National Trust at Saltram, said the trial had financial support from the National Lottery Heritage Fund.Ms Haly said: ""We are currently in the testing and trial phase of the project, where our goal is to understand what works well and best supports our audiences.""She added they had the ""unique opportunity to pilot"" the initative at Saltram ""on behalf of the National Trust to determine if this technology is effective in a heritage setting"".Follow BBC Devon on X (formerly Twitter), Facebook and Instagram. Send your story ideas to spotlight@bbc.co.uk."
42,22-Aug-24,Dad hacks database to fake death and avoid child support pay,"The man, from Kentucky, has been jailed for what a judge in the US called his ""cynical"" actions.",Technology,https://ichef.bbci.co.uk/news/480/cpsprodpb/596a/live/eb9d4ce0-6066-11ef-89d9-cf0afdbdfcb1.png.webp,https://www.bbc.com/news/articles/cgrj9r5qpego,"A man has been sentenced to more than six years in prison after hacking into a state database to fake his death, and get out of paying child support.Jesse Kipf from Kentucky, in the US, was sentenced to 81 months for computer fraud and aggravated identity theft.The 39-year-old admitted to accessing the Hawaii Death Registry System in January last year and creating a “case” for his own death.Kipf then completed a State of Hawaii Death Certificate Worksheet, assigned himself as the medical certifier for the case and certified his death, using the digital signature of the doctor.It meant he was successfully registered as a deceased person in many government databases.Kipf admitted that he did it to avoid his outstanding child support obligations of more than $100,000.The hacker also accessed other death registry systems and companies in unrelated attacks that he carried out using the stolen log in details of real physicians and workers. He was found to be offering to sell access to the systems and selling stolen databases containing private information like Social Security Numbers to other cyber criminals on the darknet. The darknet is a portion of the internet only accessible through specialist software that hides a browser’s identity. There are many darknet marketplaces where cyber criminals sell stolen data or access to compromised IT systems.Kipf sold to international buyers, including individuals from Algeria, Russia and Ukraine, the court was reportedly told.“This scheme was a cynical and destructive effort, based in part on the inexcusable goal of avoiding his child support obligations,” said Carlton S. Shier, IV, United States Attorney for the Eastern District of Kentucky.Under federal law, Kipf must serve 85 percent of his prison sentence and will be under the supervision of the U.S. Probation Office for three years.The damage to governmental and corporate computer systems and his failure to pay his child support obligations amounted to a total of $195,758.65."
