Unnamed: 0,time_ago,titles,subtitles,location,images,Links,Article_Content
16,3 days ago,Ukraine's long-range drones using Western tech to hit Russia,Western technology and finance are helping Ukraine carry out hundreds of long-range strikes inside Russia.,Business,https://ichef.bbci.co.uk/news/480/cpsprodpb/1a04/live/e1c81760-655f-11ef-9851-c5606b77a2fd.png.webp,https://www.bbc.com/news/articles/c6240qepyppo,"Western technology and finance are helping Ukraine carry out hundreds of long-range strikes inside Russia.That is despite Nato allies still refusing to give Ukraine permission to use Western-supplied munitions to do so – mostly because of fears of escalation.Ukraine has been stepping up its long-range strikes inside Russia over the past few months, launching scores of drones simultaneously at strategic targets several times a week. The targets include air force bases, oil and ammunition depots and command centres.Ukrainian firms are now producing hundreds of armed one-way attack drones a month, at a fraction of the cost it takes to produce a similar drone in the West. One company told the BBC it was already creating a disproportionate impact on Russia’s war economy at a relatively small expense.The BBC has been briefed by a number of those involved in these missions. They include one of Ukraine’s largest one-way attack drone manufacturers, as well as a big data company which has helped develop software for Ukraine to carry out these strikes.Francisco Serra-Martins says the strategy is already creating huge dilemmas for Moscow. He believes that with extra investment, it will turn the tide of the war in Ukraine’s favour.Eighteen months ago, the company he co-founded, Terminal Autonomy, didn’t even exist. It is now producing more than a hundred AQ400 Scythe long-range drones a month, with a range of 750km (465 miles). The company also makes hundreds of  shorter range AQ100 Bayonet drones a month, which can fly a few hundred kilometres.The drones are made of wood and are being assembled in former furniture factories in Ukraine.Mr Serra-Martins, a former Australian Army Royal Engineer, set up the company with his Ukrainian co-founder, backed by US finance. It is one of at least three companies now producing drones in Ukraine at scale.He describes his drones as “basically flying furniture – we assemble it like Ikea”.It takes about an hour to build the fuselage and half that time to put the brains inside it – the electronics, motor and explosives.The company’s Bayonet drone costs a few thousand dollars. In contrast, a Russian air defence missile used to shoot it down can cost more than $1m.     It is not only cheap drones making the difference. Palantir, a large US data analysis company,  was one of the first Western tech companies to aid Ukraine’s war effort. It started by providing software to improve the speed and accuracy of its artillery strikes. Now it has given Ukraine new tools  to plan its long-range drone strikes.British engineers from Palantir, working with Ukrainian counterparts, have designed a programme to generate and map the best ways to reach a target. Palantir makes clear it is not involved in the missions, but has helped train more than 1,000 Ukrainians how to use its software.The BBC has been shown how it works in principle. Using streams of data, it can map Russia’s air defences, radar and electronic jammers. The end product looks similar to a topographical chart.The tighter the contours, the heavier the air defences. The locations have already  been identified by Ukraine using commercial satellite imagery and signals intelligence.Louis Mosley of Palantir says the programme is helping Ukraine to skirt around Russia’s electronic warfare and air defence systems to reach their target.“Understanding and visualising what that looks like across the entire battle space is really critical to optimising these missions,” he says.The execution of the long-range drone strikes is being co-ordinated by Ukraine’s intelligence agencies, who work in secrecy. But the BBC has been told by other sources about some of the detail.  Scores of drones can be fired for any one mission – as many as 60 at one target.The attacks are mostly carried out at night. Most will be shot down. As few as 10% may reach the target. Some drones are even shot down along the way by friendly fire - Ukraine’s own air defences.Ukraine has had to work out ways to counter Russian electronic jamming. Terminal Autonomy’s Scythe drone uses visual positioning – navigating its course and examining the terrain by Artificial Intelligence. There is no pilot involved.Palantir software will have already mapped the best routes. Mr Serra-Martins says flying a lot of drones is key to overwhelming and exhausting Russia’s air defences.  So too is making the drones cheaper than the missiles trying to shoot them down, or the targets they are trying to hit.Prof Justin Bronk of the Royal United Services Institute says Ukraine’s long-range drone attacks  are creating dilemmas for Moscow. Although Russia has a lot of air defences, it still cannot protect everything.Prof Bronk says Ukraine’s long-range strikes are showing ordinary Russians that “the state can’t defend them fully and that Russia is vulnerable”. Ukrainian drones have been spotted more than 1,000km (620 miles) inside Russia. They have been shot down over Moscow. But the focus has been on military sites. The map below highlights just a handful of the dozen targets hit over the past few months. They include five Russian airbases.Prof Justin Bronk says targeting Russian airbases has so far been the only effective way Ukraine has to respond to Russia’s glide bombs. It has forced Russia to move aircraft to bases further away and reduce the frequency of their attacks. Satellite imagery shows how Ukrainian drones have successfully damaged hangars at its Marinovka airbase.Ukraine clearly believes it could do even more with the help of Western-made long-range weapons. But so far, allies have rejected Kyiv’s pleas. There is still a lingering fear, especially in Washington and Berlin, that it could drag the West further into the conflict. But that hasn’t stopped Western companies and finance from helping Ukraine.Ukraine is still largely having to rely on its home-grown efforts, convinced that bringing the war to Russia is a key to winning this war.Francisco Serra-Martins also believes Western manufacturers are still “woefully unprepared” to fight high-intensity warfare – producing far fewer long-range weapons at a much higher cost. He says what Ukraine really needs now “is a lot of good enough systems”. The BBC has talked to one Ukrainian company which is already developing a new cruise missile, at least 10 times cheaper than a British-made Storm Shadow missile. Despite the West’s misgivings, Ukraine is planning to step up its attacks on Russia. Mr Serra-Martins says: “What you’re seeing now is like nothing compared to what you’ll see by the end of the year."""
17,3 days ago,AI chip giant Nvidia shares fall despite record sales,The California-based technology giant has been one of the biggest beneficiaries of the AI boom.,Cumbria,https://ichef.bbci.co.uk/news/480/cpsprodpb/9f33/live/5f9e97a0-659b-11ef-99ae-29134c8b0f37.jpg.webp,https://www.bbc.com/news/articles/c984jrj24wyo,"Shares in Nvidia have fallen despite the artificial intelligence (AI) chip giant comfortably beating expectations after more than doubling its sales.Nvidia announced record revenues of $30bn (£24.7bn) over a three-month period. The company has been one of the biggest beneficiaries of the AI boom, with its stock market value soaring to more than $3 trillion.But while analysts have grown used to Nvidia producing ""spectacular"" sales growth, the latest results indicate ""that rate of growth was starting to slow,"" said Simon French, head of research at Panmure Liberum.Analysts had forecast sales growth of $28.7bn for the three months to 28 July.Nvidia surpassed this with revenues increasing by 122% compared to the same period last year. But following the release of the results, Nvidia's share price fell by 6% in after-hours trading in New York on Wednesday. On Thursday, its shares were down about 2% in early trading, but its stock remains about 150% up so far in 2024, making it one of the big winners in the US market.""It’s less about just beating estimates now,"" said Matt Britzman, senior equity analyst at Hargreaves Lansdown. ""Markets expect them to be shattered and it’s the scale of the beat today that looks to have disappointed a touch."" Announcing the latest results, Nvidia chief executive Jensen Huang said: ""Generative AI will revolutionise every industry.""But Mr French told the BBC: ""If you’re going to raise expectations that high then you’ve got to keep growing at spectacular rates.""He added that while its current AI chip - called Hopper - is selling well, the next generation Blackwell chip ""has faced some production delays and that perhaps is one of the reasons why Wall Street after hours sold off the stock"".Nvidia's results have become a quarterly event which sends Wall Street into a frenzy of buying and selling shares.A ""watch party"" had been planned in Manhattan, according to the Wall Street Journal, while Mr Huang, famed for his signature leather jacket, has been dubbed the ""Taylor Swift of tech"".Alvin Nguyen, senior analyst at Forrester, told the BBC both Nvidia and Mr Huang have become the ""face of AI"".This has helped the company so far, but it could also hurt its valuation if AI fails to deliver after firms have invested billions of dollars in the technology, Mr Nguyen said.""A thousand use cases for AI is not enough. You need a million.""Mr Nguyen also said Nvidia's first-mover advantage means it has market-leading products, which its customers have spent decades using and has a ""software ecosystem"".He said that rivals, such as Intel, could ""chip away"" at Nvidia's market share if they developed a better product, though he said this would take time."
18,3 days ago,AI chip giant Nvidia shares fall despite record sales,The California-based technology giant has been one of the biggest beneficiaries of the AI boom.,Technology,https://ichef.bbci.co.uk/news/480/cpsprodpb/9f33/live/5f9e97a0-659b-11ef-99ae-29134c8b0f37.jpg.webp,https://www.bbc.com/news/articles/c984jrj24wyo,"Shares in Nvidia have fallen despite the artificial intelligence (AI) chip giant comfortably beating expectations after more than doubling its sales.Nvidia announced record revenues of $30bn (£24.7bn) over a three-month period. The company has been one of the biggest beneficiaries of the AI boom, with its stock market value soaring to more than $3 trillion.But while analysts have grown used to Nvidia producing ""spectacular"" sales growth, the latest results indicate ""that rate of growth was starting to slow,"" said Simon French, head of research at Panmure Liberum.Analysts had forecast sales growth of $28.7bn for the three months to 28 July.Nvidia surpassed this with revenues increasing by 122% compared to the same period last year. But following the release of the results, Nvidia's share price fell by 6% in after-hours trading in New York on Wednesday. On Thursday, its shares were down about 2% in early trading, but its stock remains about 150% up so far in 2024, making it one of the big winners in the US market.""It’s less about just beating estimates now,"" said Matt Britzman, senior equity analyst at Hargreaves Lansdown. ""Markets expect them to be shattered and it’s the scale of the beat today that looks to have disappointed a touch."" Announcing the latest results, Nvidia chief executive Jensen Huang said: ""Generative AI will revolutionise every industry.""But Mr French told the BBC: ""If you’re going to raise expectations that high then you’ve got to keep growing at spectacular rates.""He added that while its current AI chip - called Hopper - is selling well, the next generation Blackwell chip ""has faced some production delays and that perhaps is one of the reasons why Wall Street after hours sold off the stock"".Nvidia's results have become a quarterly event which sends Wall Street into a frenzy of buying and selling shares.A ""watch party"" had been planned in Manhattan, according to the Wall Street Journal, while Mr Huang, famed for his signature leather jacket, has been dubbed the ""Taylor Swift of tech"".Alvin Nguyen, senior analyst at Forrester, told the BBC both Nvidia and Mr Huang have become the ""face of AI"".This has helped the company so far, but it could also hurt its valuation if AI fails to deliver after firms have invested billions of dollars in the technology, Mr Nguyen said.""A thousand use cases for AI is not enough. You need a million.""Mr Nguyen also said Nvidia's first-mover advantage means it has market-leading products, which its customers have spent decades using and has a ""software ecosystem"".He said that rivals, such as Intel, could ""chip away"" at Nvidia's market share if they developed a better product, though he said this would take time."
19,22-Aug-24,Town's Innovation Centre plans approved,Preparatory work for the four-storey building is under way and it is due to open by early 2026.,Business,https://ichef.bbci.co.uk/news/480/cpsprodpb/1471/live/da7b6250-6064-11ef-b970-9f202720b57a.png.webp,https://www.bbc.com/news/articles/cp3de31wr06o,"A planning application for a new business hub has been approved.Cumberland Council formally agreed to the Workington Innovation Centre project, which would see ""purpose-built accommodation"" for sectors including digital technology.Preparatory work on the four-storey development, to be located on part of the Central Car Park in the town centre, began in July.It has been funded through the £23.1m Workington Town Deal, approved by the Conservative government, which includes a new sports village and improvements to  the port.The Labour-led local authority said construction on the Innovation Centre would  start in the autumn, with the building expected to open in early 2026. It will primarily facilitate digital technology and advanced manufacturing businesses, the council said.There will be private and informal meeting rooms, conference spaces, and catering facilities for those using the building as well as events, the council said.John Coughlan, chairman of the Workington Town Deal Board, said: ""We know there is a lack of accommodation for those companies which are just starting out, or who want to kick start their growth, in west Cumbria, and grade A office space is virtually non-existent.""The Innovation Centre will provide the foundations for new brilliance in Cumberland, and the facilities to make it happen.""Further development is taking place nearby, including a £19m Community Diagnostic Centre offering MRI, CT and ultrasound scans, which officials said would reduce waiting times.Follow BBC Cumbria on X (formerly Twitter), Facebook and Instagram. Send your story ideas to northeastandcumbria@bbc.co.uk"
20,23-Aug-24,Tributes paid to 'UK's greatest tech entrepreneur',"A leading figure in the UK tech scene, Mike Lynch died shortly after winning a legal battle in the US.",Wear,https://ichef.bbci.co.uk/news/480/cpsprodpb/31d9/live/3f7c44f0-609f-11ef-b970-9f202720b57a.jpg.webp,https://www.bbc.com/news/articles/cdxl5kpvrg9o,"Friends and colleagues of Mike Lynch have paid tribute to ""the UK's greatest tech entrepreneur"" after he was confirmed to have died when a luxury yacht sank off the coast of Sicily.The British businessman, 59, was killed, along with his daughter Hannah, 18, and five other people when the boat foundered in stormy weather early on Monday.Their bodies were recovered following a search by divers spanning several days, with Hannah's the last to be brought ashore, on Friday.Mr Lynch was a prominent figure in the UK tech industry, where his backing of successful companies led to him being dubbed the British equivalent of Microsoft founder Bill Gates.However, he later became embroiled in a long-running legal dispute which resulted in him being controversially extradited to the US, before being acquitted earlier this summer.In a statement on Friday, a spokesperson for the Lynch family said it was a time of ""unspeakable grief"" for them.“The Lynch family is devastated, in shock and is being comforted and supported by family and friends. Their thoughts are with everyone affected by the tragedy,"" they said.Andrew Kanter, a close friend and colleague of Mr Lynch, said he was “the most brilliant mind and caring person I have ever known.”“Over nearly a quarter century I had the privilege of working beside someone unrivalled in their understanding of technology and business,” he said.Former Sun newspaper editor David Yelland said Mr Lynch was ""an irreplaceable loss not only to those that loved him but also to the country"".""He is the UK's greatest tech entrepreneur of recent decades, a family man, a long-time client of my business and a friend,"" he said.""To think Mike Lynch lost his life just as he began to rebuild it is devastating for all those that know him.""Morgan Stanley International bank chairman Jonathan Bloomer, his wife Judy Bloomer, Clifford Chance lawyer Chris Morvillo, his wife Neda Morvillo and Recaldo Thomas, the yacht's chef, also died when the vessel sank.In a statement confirming their parents' deaths, the Bloomer family described the couple as ""incredible people and an inspiration to many"".Mr Lynch is survived by his wife Angela Bacares, who was rescued, along with 14 others, after the yacht sank, as well as their elder daughter Esme. Mike Lynch and Angela Barcares lived at the Loudham Hall estate in Suffolk.Brent Hoberman, co-founder of Lastminute.com, described the events as ""tragic"", saying Mr Lynch had much more to give to the UK tech scene.""He was still on his journey, and he’d been sidetracked for a decade with this court case,"" he told the BBC.""I think there was a lot of unfulfilled potential.""IT analyst Richard Holway said in a post on LinkedIn that Mr Lynch - a friend of more than 25 years - was ""a unique British tech talent"". ""Goodness knows what he could have achieved next,"" he added.Mr Lynch co-founded tech firm Autonomy in 1996, which expanded rapidly and was sold to Hewlett Packard for $11bn (£8.6bn) in 2011, from which he is believed to have netted £500m.But questions over the sale of Autonomy led to a long-running legal battle.In 2022, Mr Lynch lost a civil fraud case against HP at the High Court in London.A day later, he was extradited to the US as part of criminal proceedings, and was facing a possible two decades in jail.He was acquitted in June this year after a jury found him not guilty of the crimes.He told BBC Radio 4 that though he was convinced of his innocence, he was only able to prove it in a US court because he was rich enough to pay the enormous legal fees involved.Mr Lynch is reported to have gone on the yacht trip with his family to celebrate securing his freedom.Its name, Bayesian, is understood to derive from the theory that his PhD thesis - and the software that underpinned Autonomy - was based on.Witnesses say its aluminium mast broke in half in a storm, causing the ship to lose its balance and sink.Dick Smith, a neighbour of Mr Lynch, told the BBC he was ""reeling from the shock of the news"".""He was so approachable and a very easy person to talk to with a nice sense of humour,"" he said.""You might think with all that money he would be difficult to talk to, but in fact he was a very easy person to talk to.""Born on 16 June 1965, Mr Lynch was the son of a nurse and a fireman, and was raised near Chelmsford in Essex.His first computer was a BBC Micro, and he wrote fondly of how it shaped his passion for programming in a 2011 BBC article celebrating 30 years of the device.While at school his ""first foray into commercialisation of technology"" came when designing a digital sampler that could sample music, then selling the designs, according to a 2017 interview.He continued the hobby while studying Natural Sciences at the University of Cambridge - where he said he annoyed his college by getting ""solder in the carpets"" of his room.While at Cambridge he earned a PhD in mathematical computing, and later undertook a research fellowship.In 1991, Mr Lynch helped establish Cambridge Neurodynamics - a firm which specialised in using computer-based detection and recognition of fingerprints.His tech firm Autonomy was created five years later, using a statistical method known as ""Bayesian inference"" at the core of its software.The company's fast-paced growth and success throughout the late 1990s and early 2000s saw Mr Lynch earn a number of awards and accolades.In 2006 he was awarded an OBE in recognition of his service to UK enterprise.He served on the board of the BBC as a non-executive director, and in 2011 was appointed to the government's council for science and technology - advising then-Prime Minister David Cameron on the risks and possibilities of AI development.Following the sale of Autonomy, Mr Lynch established tech firm Invoke Capital, which helped create prominent UK cybersecurity firm Darktrace in 2013. Lynch had a seat on its board until earlier this year.Reacting to the news on Thursday, a spokesperson for Darktrace said that they were shocked by the tragedy, describing Mr Lynch as an ""active champion"" of the UK's technology sector.""His loss will be felt by many,"" they added."
21,5 days ago,UK to spend £10.5m on new EU border checks,Travellers from the UK and other non-EU countries will soon have to go through a new digital border system.,Stoke & Staffordshire,https://ichef.bbci.co.uk/news/480/cpsprodpb/45fd/live/cb802730-6466-11ef-b2e6-ff1dccf4865c.jpg.webp,https://www.bbc.com/news/articles/c4gz9n06rxdo,"The government is to provide £10.5m worth of funding to prepare for new EU border checks this autumn.The Port of Dover, Eurotunnel at Folkestone and Eurostar at St Pancras will receive financial aid to help reduce queues for travellers.From the autumn, travellers from the UK and other non-EU countries will have to go through a new digital border system called the Entry/Exit System (EES), which is being brought in by the EU.This will involve having your photograph and fingerprints taken.The government money will be spent on providing ports with the necessary technology to complete these checks.The scheme applies to British people and other non-EU nationals entering a European country using the EES for a short stay.They will need to register fingerprints and a photo with their passport details to proceed with travel.Every time those travellers enter or exit a participating European country, this will be recorded. Once they have given their fingerprints and details, that registration will be valid for three years.During that time it must be validated every time someone crosses the border. This will replace passport-stamping.In most cases the EES checks will happen when you arrive at an international airport but if you're travelling via the Port of Dover or an international train then the checks will take place in the UK.The technology that ports will use to take biometric data of travellers has not yet been confirmed.It was previously suggested that a gadget similar to an iPad could be used to take fingerprints. The EES was originally meant to begin in 2022 but it has faced many setbacks.It had previously been rescheduled for May 2023, then the end of 2023, and now is expected to come into force in November 2024.Lilian Greenwood, Future of Roads Minister, said the government had been reviewing the EES plans to ensure ""registration can be smooth and queue times kept to a minimum"".""Nobody wants to see excessive queues at our ports, which is why we’re providing this funding to ensure our borders are as prepared as possible for the upcoming change – despite EES being an EU initiative,"" she added.Eurostar chief safety and stations officer Simon Lejeune said the government had supported an upgrade of its technology and facilities to meet the requirements. “Eurostar will be fully prepared and compliant by November, ensuring a smooth transition for all our passengers,"" he added.Emma Ward, chief operations officer for the Port of Dover, said the port was doing all it could to be ""ready with the facilities that will be used by French border officials operating the new system"".Each port is set to receive £3.5m of the funding, which is the first of its kind aimed at preventing EES-related delays.The government money will be used by Dover to help pay for a marina to be filled in, in order to provide extra space for coach passengers to be processed. Eurostar and Eurotunnel will use their share to pay for technology and staff training. Eurotunnel will add more kiosks if needed.All three have already invested tens of millions of pounds of their own money on preparing for the new system.Getlink, which manages Eurotunnel, started work two years ago to adapt to EES changes.""The focus has always been on customer satisfaction, delivering the most competitive crossing time and experience at the border for non-EU travellers,"" Yann Leriche, chief executive of Getlink, said."
